Date,Source,Headlines,Teaser
  August 2014 ,Southern Medical Journal,Tiotropium in the Treatment of Patients With Asthma,"Tiotropium, a long-acting anticholinergic agent used in patients with COPD, is showing encouraging results as an alternative treatment in patients with asthma."
  August 2014 ,Emerging Infectious Diseases,Outcomes of Streptococcus suis Infection in Humans,"Streptococcus suis is a bacterium that affects pigs, but can cause systemic disease in humans. What are the risk factors and outcomes?"
  August 2014 ,European Heart Journal,Catheter-Based Renal Denervation for Resistant Hypertension,Learn more about long-term results of renal artery denervation for treatment of treatment-resistant hypertension.
  August 2014 ,Current Opinion in Infectious Diseases,Avoiding Antibiotics in Skin Inflammation and Infection,What is the clinical value of antiseptics and antiseptic dressings for skin infection in this era of antimicrobial resistance?
  August 2014 ,Journal of Cardiovascular Electrophysiology,Decreased Inappropriate Shocks by Remote Monitoring of ICD,Find out more about automatic wireless remote monitoring of ICDs -- to reduce inappropriate shocks.
  August 2014 ,Journal of the American Geriatrics Society,Determining Normal Cognitive Function vs. MCI in Older Adults,This study examined whether pre-clinical disability in performance of cognitively focused ADL tasks can discriminate between older adults with normal cognitive function and those with MCI.
  August 2014 ,BMC Psychiatry,Comorbid Type 1 Diabetes and Eating Disorders,"Patients with T1DM are at risk of developing eating disorders, particularly bulimia. Do motivations and treatment outcomes differ between individuals with eating disorders and T1DM, and those without?"
  August 2014 ,BMC Clinical Pathology,Testing by Hematopathology Specialty and Other Laboratories,Successful management of patients with hematologic malignancies depends upon early and accurate diagnosis. Does a specialized hematopathology lab do better than a traditional lab?
  August 2014 ,Neurosurgical Focus,Bracing for Thoracolumbar Fractures,"Find out more about bracing, a low-risk, cost-effective method to treat certain thoracolumbar fractures, equivalent to that of surgical management in many cases."
  August 2014 ,American Journal of Clinical Dermatology,Diabetic Foot Ulcer: An Evidence-Based Treatment Update,Potentially life-threatening diabetic foot ulcers can be extremely challenging to treat. This review presents the latest evidence-based research on a wide range of treatment modalities.
  July 2014 ,Translational Lung Cancer Research,Lung Cancer Vaccines: Current Status and Future Prospects,Find out how a greater understanding of the immune system and tumor antigens has led to advances in the use of immunotherapy -- including vaccines to target lung cancer.
  August 2014 ,Diabetes Care,Statins and the Risk of Diabetes,A potential downside of adherence? Read how statin use may increase risk of diabetes.
  August 2014 ,BMC Infectious Diseases,Efficacy of Surface Disinfectants Against Resistant Bacteria,How effective are surface disinfectant cleaners against multi-drug resistant bacteria?
  August 2014 ,American Heart Journal,Adipose-Derived Regenerative Cells in Ischemic Cardiomyopathy,Can liposuction-leavings help patients with ischemic cardiomyopathy?
  August 2014 ,Clinical Endocrinology,Diagnosis and Management of Gastric Neuroendocrine Neoplasms,Gastric neuroendocrine neoplasms are not associated with any specific symptoms. When should you be suspicious?
  August 2014 ,The American Journal of Gastroenterology,Fecal Transplant for C Diff in Immunocompromised Patients,Is fecal transplant a successful and safe treatment for immunocompromised patients with C. difficile infection? This new study looks at the latest research.
  August 2014 ,European Heart Journal,Totally Subcutaneous Implantable Defibrillator,Does the new alternative to conventional transvenous ICD systems minimize complications such as inappropriate shocks?
  August 2014 ,Medicine and Science in Sports and Exercise,Cut Points of Muscle Strength Linked to Metabolic Syndrome,At which threshold of muscle strength does the risk for metabolic syndrome increase? A new study investigates the issue in men.
  August 2014 ,Menopause,Women's Health Initiative Calcium/Vitamin D Randomized Trial,"Are increased serum 25-hydroxyvitamin D concentrations, in response to calcium/vitamin D supplementation, associated with an improved lipid profile in postmenopausal women?"
  August 2014 ,American Heart Journal,Chelation With Multivitamins for Coronary Disease,"In stable post-MI patients on evidence-based medical therapy, how does the combination of oral high-dose vitamins and chelation therapy compare with double placebo -- for impact on cardiovascular events?"
  August 2014 ,AIDS,Drug Resistance Among Newly Diagnosed HIV-Infected Children,How should drug resistance in HIV-infected infants and young children be managed?
  August 2014 ,Pediatric Critical Care Medicine,Time for a Neonatal-Specific Consensus Definition for Sepsis,How has sepsis been defined in neonates and is it dynamic enough?
  August 2014 ,Journal of the American College of Cardiology,Practice Guidelines for the Management of LDL-Related Risk,Managing risk related to LDL is vital for patients at risk for atherosclerotic cardiovascular disease events -- given its role in atherogenesis.
  August 2014 ,Current Orthopaedic Practice,Surgical and Anatomic Considerations in ACL Reconstruction,What's the latest in ACL reconstruction surgery? This article will bring you up to date.
  August 2014 ,Applied Radiology,Basics of Diffusion and Perfusion Imaging in Brain Tumors,"This article presents the basic principles of perfusion and diffusion MRI imaging of the brain, providing clinical examples of their application in predicting brain tumor type and grade."
  August 2014 ,Diabetes,Diabetes and Cardiovascular Disease in Older Adults,Why are the aging heart and vessels vulnerable to diabetes?
  August 2014 ,JAIDS: Journal of Acquired Immune Deficiency Syndromes,Adherence Pattern to a Daily Oral Pre-exposure Prophylaxis,"What factors are associated with good adherence to daily, oral HIV pre-exposure prophylaxis?"
  August 2014 ,Future Neurology,New Imaging Techniques Reveal Metabolism of the Aging Brain,Brain metabolism is an important biomarker for aging and neurodegenerative disorders. What can the latest neuroimaging techniques tell us about the aging brain?
  August 2014 ,Clinical Lipidology,Novel Anti-obesity Drugs and Plasma Lipids,Can 'one pill make you smaller' yet?
  August 2014 ,Liver International,Efficacy of Nitazoxanide in the Treatment of HCV Genotype 4,"What does the latest research tell us about the efficacy of nitazoxanide, pegylated interferon, and ribavirin in combination for the treatment of genotype 4 chronic hepatitis C?"
  August 2014 ,Human Reproduction,Combination Treatment for Non-tubal Ectopic Pregnancies,"Is combination gefitinib and methotrexate therapy a safe and effective treatment for non-tubal ectopic pregnancies, and does it resolve the pregnancies without the need for surgery?"
  August 2014 ,The American Journal of Gastroenterology,A Personalized Medicine Approach to the Management of IBD,How can clinicians apply the therapeutic principles of personalized medicine to the medical management of patients with inflammatory bowel disease?
  August 2014 ,American Journal of Clinical Pathology,Endometrial Hyperplasia in Epithelial Ovarian Cancer,How prevalent are endometrial premalignancies in women diagnosed with epithelial ovarian cancer?
  August 2014 ,Newborn & Infant Nursing Reviews,Therapeutic Hypothermia for Neonatal Encephalopathy,Nurses play a large role in the identification and care of infants receiving therapeutic hypothermia.
  August 2014 ,Current Opinion in Gastroenterology,Steroids vs Dietary Therapy to Treat Eosinophilic Esophagitis,Are steroids more effective than dietary therapy in the treatment of eosinophilic esophagitis? This new study investigates.
  August 2014 ,American Heart Journal,Trends in Pharmacologic Management of Atrial Fibrillation,Learn more about patients with new AF episodes who were prescribed oral rate or rhythm control medications.
  August 2014 ,Current Opinion in Infectious Diseases,Skin Antisepsis in the Neonate: What Should We Use?,What are the most effective yet safest topical antiseptics for use in neonates to reduce nosocomial sepsis?
  August 2014 ,AIDS,Nonoccupational Postexposure Prophylaxis for HIV Prevention,There have been many challenges with the implementation of HIV nonoccupational postexposure prophylaxis. What new solutions are on the horizon?
  August 2014 ,U.S. Pharmacist,Cardiovascular Risk With NSAIDs and COX-2 Inhibitors,Which NSAID is the safest in patients with high cardiovascular risk?
  August 2014 ,HIV Medicine,Once-Daily MVC plus DRV/r in Pretreated HIV Patients,This study assesses the efficacy and safety of MVC plus DRV/r once-daily in HIV-infected pretreated patients.
  August 2014 ,Applied Radiology,MRI in Abdominopelvic Emergencies,"MRI can be a useful alternative to CT in abdominopelvic emergencies. When is it most appropriate, and when is it contraindicated?"
  August 2014 ,Endocrine Practice,AACE/ACE Consensus Statement on Insulin Pump Management,"Learn everything there is to know about insulin pumps... Like how and when to use them, and which patients would benefit most."
  August 2014 ,Western Journal of Emergency Medicine: Integrating Emergency Care with Population Health,Epidemiology of SIRS in the Emergency Department,Gain a better understanding of the epidemiology of SIRS among adult ED patients.
  August 2014 ,Nutrition and Metabolism,Obesity & 25-Hydroxyvitamin D Deficiency in Cerebral Palsy,Is there an association between vitamin D deficiency and obesity in patients with cerebral palsy?
  August 2014 ,Age and Ageing,Acute Coronary Syndrome Management in Older Adults,"Management of acute coronary syndrome in older adults remains a clinical challenge, despite existing guidelines. What are the reasons for age-dependent inequalities in care?"
  August 2014 ,Wounds,Sural Fasciocutaneous Flap for Knee and Lower Leg Defects,Learn more about clinical outcomes of using a sural fasciocutaneous island flap for reconstruction of traumatic soft-tissue defects around the knee and on the proximal lower leg.
  August 2014 ,Journal of Viral Hepatitis,Relapse Rates in Chronic HBV After Stopping Antivirals,How can clinicians prevent relapse in patients with chronic hepatitis B after discontinuation with antiviral therapy?
  August 2014 ,Nursing Economics,Group Visits for Chronic Illness Management,Group visits are increasingly being used as a substitute for individual patient visits in a wide variety of settings and for diverse patient populations. Find out why.
  August 2014 ,Seminars in Respiratory and Critical Care Medicine,Sarcoidosis: Recent Advances,Find out about the scientific and clinical progress of the past 4 years -- in sarcoidosis management.
  August 2014 ,Alimentary Pharmacology & Therapeutics,The Epidemiology and Prevention of Gastric Cancer,"How does gastric cancer develop, what are some of the potential causes, and how can it be prevented?"
  August 2014 ,The Pediatric Infectious Disease Journal,Antibiotic Utilization in Pediatric Soft Tissue Infections,Children hospitalized for soft tissue infection are often prescribed broad spectrum antibiotics. Is there an opportunity to reduce the antibiotic use in these patients?
  August 2014 ,HIV Medicine,Raltegravir in Virologically Suppressed Overweight Women,"When women with central adiposity switch to RAL from a PI or NNRTI, they could experience a significant decrease in sCD14."
  August 2014 ,AIDS,Pre-exposure Prophylaxis and Contraception Effectiveness,How effective are hormonal contraceptives for pregnancy prevention in women taking HIV pre-exposure prophylaxis?
  August 2014 ,American Heart Journal,Early Termination of Cardiovascular Trials Due to  Recruitment,Is there a common thread between terminated trials?
  August 2014 ,Interventional Cardiology,"Renal Sympathetic Denervation: Indications, Contemporary Devices",Learn more about the utility of renal denervation and emerging devices along with issues to be addressed before renal denervation becomes mainstream therapy.
  August 2014 ,Malaria Journal,Acceptance of a Malaria Vaccine by Caregivers in Kenya,Several malaria vaccines are currently in clinical trials and are expected to improve malaria control world-wide. Will the countries that need it most accept this practice?
  August 2014 ,Future Oncology,Ofatumumab as Front-Line Therapy in Untreated CLL,Find out about the efficacy and toxicities of ofatumumab alone and in combination for the front-line treatment of CLL.
  August 2014 ,OJIN: The Online Journal of Issues in Nursing,The Affordable Care Act: Primary Care and the DNP,Learn how the ACA serves as a model for prevention and the role of DNP nurses as primary care providers.
  August 2014 ,BMC Public Health,Engaging T2DM Patients in Their Own Health Management,Engaging patients in their care is a crucial issue in the treatment and management of type 2 diabetes. What factors might contribute to fostering--or hindering--patient engagement?
  August 2014 ,Spine,Nonoperative Management of Discogenic Back Pain,Find out about various non-surgical options for treating discogenic back pain.
  August 2014 ,American Journal of Pharmaceutical Education,Effectiveness of E-learning in Pharmacy Education,"E-learning may increase knowledge in the short-term, but how about the long-term?"
  August 2014 ,Western Journal of Emergency Medicine: Integrating Emergency Care with Population Health,Yield and Predictors of Thoracic Spine Injury From Chest CT,How useful is chest CT in evaluating blunt trauma patients for thoracic spine injuries?
  August 2014 ,The Pediatric Infectious Disease Journal,Escherichia coli Bacteremia in Children,Examining the age and portal of entry could help predict severity of E. coli bacteremia in children.
  August 2014 ,The British Journal of Dermatology,Omalizumab for Chronic Idiopathic or Spontaneous Urticaria,Could the recombinant humanized anti-IgE monoclonal antibody omalizumab be effective for improving symptoms in patients with chronic idiopathic urticaria?
  August 2014 ,Headache,Treatment Persistence and Switching in Triptan Users,Triptans can be a valuable option for acute treatment of migraine. So why is treatment persistence with triptans so low?
  August 2014 ,BMC Oral Health,Dental Plaque Bacteria Susceptibility to Triclosan,Triclosan is a broad-spectrum antimicrobial agent used in toothpastes and mouthwashes. Does susceptibility to triclosan decline over time?
  August 2014 ,Critical Care Medicine,Door-to-Balloon Time Not Most Critical Factor in STEMI Outcome,A new metric for STEMI patients may be on the near horizon. Find out more.
  August 2014 ,Clinical Endocrinology,Gonadotropins for Male Hypogonadotrophic Hypogonadism,How does testosterone compare with gonadotropin treatment for improving quality of life in hypogonadism?
  August 2014 ,Chinese Clinical Oncology,New Challenge of Developing Combined Radio-Drug Therapy,Find out more about development of combined modality treatments that can be used to improve control of local disease without increased toxicity.
  August 2014 ,BMC Pregnancy and Childbirth,Post-traumatic Stress Symptoms Following Childbirth,Does mode of delivery determine whether a woman will experience post-traumatic stress symptoms after giving birth?
  August 2014 ,The Journal of Invasive Cardiology,Comparison of Resource Utilization of Pulmonary Vein Isolation,Find out about the first US multicenter examination to report the procedural comparisons between cryoballoon and focal RF catheters used for treatment of PAF.
  September 2014 ,Rheumatology,Type I Interferon Blockade in Systemic Lupus Erythematosus,IFN-blocking strategies for the treatment of SLE are currently being evaluated in clinical trials. Are the results looking promising?
  September 2014 ,Skin Therapy Letter,Sirolimus: A Therapeutic Advance for Dermatologic Disease,"Originally approved as an immunosuppressant in transplant recipients, the mTOR inhibitor sirolimus is proving to have a multitude of applications in dermatologic diseases and as an anti-aging agent."
  September 2014 ,Journal of the National Cancer Institute,CTCs and Survival in Breast Cancer Patients,Find out how the SUCCESS trial provides strong evidence for the prognostic relevance of CTCs in early breast cancer before and after adjuvant chemotherapy.
  September 2014 ,BMC Psychiatry,Predictors of PTSD Symptoms Following Childbirth,Posttraumatic stress disorder following childbirth is increasingly being recognized. Can factors be determined to help predict its occurrence?
  September 2014 ,European Heart Journal,Reperfusion Therapy for ST Elevation Acute Myocardial Infarction,Take a contemporary look at how use and type of reperfusion therapy vary in patients admitted with STEMI.
  September 2014 ,Current Opinion in Infectious Diseases,Managing Infections in Pregnancy,Viral and parasitic infections in pregnancy may affect fetal development. How should these infections be managed?
  September 2014 ,American Journal of Clinical Dermatology,A Practical Approach to Cutaneous Small-Vessel Vasculitis,"The article presents a comprehensive overview of cutaneous small-vessel vasculitis, with a practical guide to its clinical features, etiology, laboratory evaluation, and management."
  September 2014 ,AIDS,Is Bone Loss Linked to Chronic Inflammation in HIV?,What role do inflammation and vitamin D play in HIV bone loss?
  September 2014 ,American Heart Journal,Agreement on Outcome in a Cardiovascular RCT,Learn more about agreement between randomized trial outcome assessment by committee vs outcomes entirely identified through public registers.
  September 2014 ,Seminars in Neurology,Frontotemporal Lobar Degeneration: A Clinical Approach,"This review outlines a clinical approach to frontotemporal lobar degeneration, from epidemiology to diagnostic criteria and current and prospective treatments."
  August 2014 ,Annals of Clinical Microbiology and Antimicrobials,Multidrug-Resistant K. pneumoniae Isolates,This study investigated the molecular characterization of multi-drug resistant K. pneumoniae isolated from a variety of clinical samples of hospitalized patients.
  August 2014 ,BMC Ophthalmology,The Risk of Cataract in Type 2 Diabetes,Are patients with type 2 diabetes at a higher risk of developing cataracts? A new meta-analysis investigates the issue.
  August 2014 ,Influenza and Other Respiratory Viruses,Clinical Severity of Rhinovirus/Enterovirus in Children,How does the severity of rhinovirus/enterovirus compare to the severity of influenza or RSV in children?
  August 2014 ,BMC Public Health,Hepatitis C Screening Among Young People Who Inject Drugs,"Injection-drug users are at high risk for hepatitis C infection, yet many remain unaware of their infection status. Might the rapid HCV test encourage drug abusers to be screened?"
  August 2014 ,Nutrition and Metabolism,"Prehypertension, Adiponectin, and Insulinemia in Obesity",Why does obesity lead to sodium retention and increased blood pressure?
  August 2014 ,Diabetes Care,Psychological Distress and Incidence of Type 2 Diabetes,Do depression and anxiety increase the risk for diabetes?
  August 2014 ,Headache,Evaluation and Treatment of Migraine in the ED,Acute migraine is a common reason for emergency department visits. This review offers practical guidance on how patients with suspected migraine should be evaluated and managed in the ED setting.
  August 2014 ,Current Opinion in Pulmonary Medicine,Pulmonary Hypertension With COLD and Pulmonary Fibrosis,Learn more about how severe pulmonary hypertension worsens the prognosis of patients with COPD or idiopathic pulmonary fibrosis.
  August 2014 ,American Journal of Cardiovascular Drugs,Agents for Atrial Fibrillation Prevention After Cardioversion,"The acute success rate with electrical cardioversion is high, but relapse happens. Find out how to beat the odds of AF recurrence."
  August 2014 ,International Journal of Clinical Rheumatology,Variability in Response to Rituximab in Autoimmune Diseases,This article describes the variability in clinical response to rituximab in the treatment of rheumatoid arthritis and systemic lupus erythematosus.
  September 2014 ,Journal of the National Cancer Institute,MRI-Guided Ultrasound for Painful Bone Metastases,Learn more about the safety and efficacy of this noninvasive method of thermal tissue ablation for palliation of pain due to bone metastases.
  September 2014 ,BMC Anesthesiology,Intubating Conditions and Side Effects of Intubation Drugs,Which combination of drugs used for intubation produce more acceptable intubating conditions?
  September 2014 ,The American Journal of Gastroenterology,Genetic Evaluation and Management of Lynch Syndrome,What do the latest guidelines say about genetic testing for and management of Lynch syndrome?
  September 2014 ,Brain,Early Identification of 'Acute-Onset' Chronic IDP,The authors identify changes in nerve excitability parameters that can distinguish acute-onset chronic inflammatory demyelinating polyneuropathy from acute IDP at the earliest stages.
  September 2014 ,Nanomedicine,Interview With Donald E Ingber,"Donald E. Ingber, Founding Director of Harvard's Wyss Institute for Biologically Inspired Engineering, recounts his career in bioengineering and recent work in nanomedicine and cancer therapeutics."
  September 2014 ,Interventional Cardiology,Interventional Radiology - Current and Future,"Today it's amazing, but the future for interventional radiology may be even brighter . . ."
  September 2014 ,Journal of the American College of Cardiology,Transition From Blinded Study Drug to Open-Label,Learn about an end-of-trial transition plan to minimize bleeding and stroke risks during a critical period.
  September 2014 ,Liver International,Treatment of Chronic Hepatitis C Virus Infection,What are some of the remaining barriers to effective hepatitis C treatment in the United States?
  September 2014 ,BMC Clinical Pathology,Serum TFF3 and Response to Chemotherapy in GI Cancers,"This study investigated the feasibility of protein serum trefoil factor 3 as a biomarker for gastrointestinal cancer, as well as a pharmacodynamic predictor of response to chemotherapy."
  September 2014 ,Future Oncology,Targeted Therapies in Advanced Renal Cell Carcinoma,Are metastatic sites associated with survival in patients with renal cell carcinoma treated with targeted therapies?
  September 2014 ,American Journal of Pharmaceutical Education,Cost Savings Associated With Pharmacy Student Interventions,Student identification of potential allergic reactions and drug interactions can save health care dollars.
  September 2014 ,Wounds,Radiation Dermatitis Evidence From a Clinical Practice Guideline,Patients undergoing external radiation therapy to treat cancer often experience acute radiation dermatitis. These evidence-based guidelines provide prevention and treatment recommendations.
  September 2014 ,Preventing Chronic Disease,A Strength Training Program for Primary Care Patients,Strength training can be a powerful intervention for improving the health of older adults. How can primary care physicians best expand access to strength training for their patients?
  September 2014 ,Future Virology,Strategies to Eliminate HBV Infection,What novel strategies are being used to achieve sustained cure or elimination of HBV?
  September 2014 ,The British Journal of Dermatology,Methotrexate and Liver Fibrosis in People With Psoriasis,Does methotrexate actually increase the risk of liver fibrosis/cirrhosis in people with psoriasis or is this just an association?
  September 2014 ,Headache,Spreading Depolarization May Link Migraine and Stroke,Does enhanced susceptibility to spreading depolarization explain the underlying  mechanism of the migraine-stroke association?
  September 2014 ,Alimentary Pharmacology & Therapeutics,"Why, When, and How to De-escalate Therapy in IBD",How do clinicians know when to safely start tapering drug therapies in patients with different inflammatory bowel diseases?
  September 2014 ,BMC Endocrine Disorders,ICU Glucose Control: Space GlucoseControl System,This device can help control glucose in critically ill patients.
  September 2014 ,Nephrology Dialysis Transplantation,CKD-Renal Epidemiology and Information Network Cohort Study,What does the latest research tell us about the factors associated with CKD progression and its transition to ESRD?
  September 2014 ,BMC Oral Health,Self-Induced Vomiting and Dental Erosion -- A Clinical Study,"Dentists may be the first to spot this common, but often unrecognized, complication of bulimic eating disorders."
  September 2014 ,Journal of the National Cancer Institute,Lifestyle and Cancer-Associated DNA Change in the Colon,"Aberrant DNA methylation in gene promoters is associated with aging and cancer, but the circumstances determining methylation change are unknown."
  September 2014 ,Annals of Family Medicine,CVD Risk Among Women With Prior Pregnancy Loss,Is a history of miscarriage or stillbirth an independent risk factor for incident coronary artery disease in postmenopausal women?
  September 2014 ,JAIDS: Journal of Acquired Immune Deficiency Syndromes,Effectiveness of Once-Daily ART vs a Triple-Tablet Regimen,"Switching from a once-daily, single tablet ART regimen to a triple-tablet regimen may result in drug cost savings, but are there other risks involved?"
