Date,Source,Headlines,Teaser
  July 2002 ,Neurosurgical Focus,Outcome Measures for Clinical Trials in Neurotrauma,More than 40 years have passed since the first therapeutic trials were designed to test the ability of medications to improve outcome after severe TBI.
  June 2002 ,Southern Medical Journal,Selected Ongoing Clinical Trials,The following trials are designed to help physicians treat osteoporosis.
  July 2002 ,Medscape General Medicine,Medscape Psychopharmacology Today,Development process for drugs
  May 2002 ,Southern Medical Journal,Selected Ongoing Clinical Trials,The following trials are designed to help physicians treat thyroid dysfunction.
  June 2001 ,Abstracts in Hematology & OncologyTM,Urothelial Cancer: A Phase II Trial,A study evaluates efficacy and toxicity in previously untreated patients with advanced transitional cell carcinoma.
  January 2002 ,Southern Medical Journal,Selected Ongoing Clinical Trials,The following clinical trials are designed to help physicians treat diabetes as well as their potential complications.
  December 2001 ,Southern Medical Journal,The Female Patient: Selected Ongoing Clinical Trials,"The following trials are designed to help physicians keep up to date on the topics of cervical cancer, and more."
  June 2001 ,Seminars in Neurology,Clinical Trials in ALS: An Overview,"Women's participation in clinical trials, particularly those involving drugs, has been said to be both overrepresented and underrepresented. Studies of participation are compared and contrasted to elucidate some reasons for this contradiction."
  October 2001 ,Medscape General Medicine,Participation of Women in Clinical Trials of Drug Therapies,"Several new antifungal agents, including novel compounds in familiar classes and entirely new classes targeting previously untapped mechanisms, are in various stages of the drug development process."
  August 2001 ,Pharmacotherapy,Investigational Antifungal Agents,"Although the market for lipid-lowering medications is dominated by statins, the rise in statins predated the recent clinical trials supporting their use."
  June 2001 ,American Heart Journal,Randomized Clinical Trials and Recent Patterns in the Use of Statins,An excellent information Web site for clinical trials is now available.
  June 2001 ,American Heart Journal,Randomized Clinical Trials and Recent Patterns,"Some of the revolutionary drugs expected from human genome research may reach the pharmacy shelf sooner than expected, according to Francis Collins, MD, director of the National Human Genome Research Institute at the National Institutes of Health."
  March 2001 ,Cancer Control: Journal of the Moffitt Cancer Center,Resources on the Web - Searching for Information on Clinical Trials,Does the right of incarcerated prison and jail inmates to healthcare include access to clinical trials?
  January 2001 ,Pharmacy Today,Genome Map Spurring Drug Development Ahead of Schedule,Review the Office for Human Research Protections and FDA guidelines relevant to the conduct of HIV/AIDS clinical trials in correctional facilities.
  January 2001 ,The AIDS Reader®,HIV Clinical Trials in Correctional Settings: Right or Retrogression?,"Explore the advancements in clinical trial methodology, their utility in establishing treatment guidelines, and their impact on medical practice."
  January 2001 ,The AIDS Reader®,IRB/FDA Requirements Relevant to HIV/AIDS Clinical Trials,"During the past few years, a number of abuses have been committed in clinical trials."
  July 2007 ,International Journal of Clinical Practice,Recent Trials of Lipid Lowering,This narrative review summarises the key recent clinical trials of lipid lowering since 2004 and their implications for future patient care.
  May 2007 ,The British Journal of Dermatology,Methyl Aminolaevulinate-photodynamic Therapy,The efficacy and low risk of side-effects afforded by this therapy have resulted in high patient preference in clinical trials.
  May 2007 ,Nature Clinical Practice Oncology,A Remedy for Biomarker Addiction: Rational Anticancer Drug Development,The post-genomic era would seem to be an opportune time to rewrite the laws of cancer drug development. Where is the best place to start?
  April 2007 ,JAIDS: Journal of Acquired Immune Deficiency Syndromes,Metabolic Effects of Protease Inhibitor-Sparing ART Regimens Given for HIV,"Lipids were higher in efavirenz-containing 3- or 4-drug regimens, whereas body circumference measurements increased then returned to baseline by 192 weeks in this strategy trial."
  April 2007 ,Nature Clinical Practice Oncology,How can we Improve Clinical Trials?,"Ideally, phase II oncology trials would quickly and efficiently identify genuine therapeutic advances. Strategies such as adding a 'real-world' cohort, amongst others, may facilitate improvement."
  August 2006 ,Nature Clinical Practice Neurology,Confounders to Spinal Cord Injury Clinical Trials,"Learn about the status of translational research in spinal cord injury trials, focusing on issues about concurrent use of methylprednisolone, and other potential confounders and possible solutions."
  February 2006 ,Alimentary Pharmacology & Therapeutics,7-Point Global Overall Symptom Scale for Dyspepsia,"At present, there is no consensus regarding the optimal method for measuring the severity of dyspepsia symptoms in clinical trials."
  January 2006 ,Nature Clinical Practice Oncology,Phase III Clinical Trials on Anti-VEGF Therapy for Cancer,"Read the contrasting results, as well as mechanisms underlying normalization of tumor vasculature, and the need for biomarkers and imaging techniques to guide patient selection and protocol designs."
  December 2004 ,Current Medical Research and Opinion,Measuring Symptom Response to Pharmacological Interventions,There is a clear need for a fully developed and validated tool for measuring the effects of therapeutic interventions on symptoms in COPD in clinical trials.
  May 2004 ,Pharmacotherapy,Single-Dose Pharmacokinetics of Sodium Ferric Gluconate Complex,Sodium ferric gluconate complex in sucrose injection (SFGC) is an iron formulation marketed in the United States as Ferrlecit.
  April 2004 ,Journal of Cardiovascular Electrophysiology,Drug-Induced Torsades de Pointes and Implications for Drug,"A review of the techniques and limitations of methods directed at drug-related phenomena, clinical trials, interpretation of ECGs, and evaluation of drug-related risks and benefits."
  March 2004 ,Current Medical Research and Opinion,Eletriptan for the Acute Treatment of Migraine:  Results of,"Eletriptan is a potent, selective 5-HT1B/1D agonist that has been studied in multiple double-blind, placebo-controlled clinical trials conducted on migraineurs in Europe, Australia, Canada and the US."
  March 2004 ,Arthritis Research & Therapy,"Equipoise, Design Bias, and Randomized Controlled Trials","The concept of 'equipoise', the 'uncertainty principle', has been represented as a central ethical principle of human experimentation."
  March 2004 ,Emerging Infectious Diseases,Clinical Trials and Novel Pathogens: Lessons From SARS,The recognition of SARS as a transmissible disease prompted international efforts to identify its cause and control its spread.
  January 2004 ,Wounds,Protocols for Advanced Technology Clinical Trials,"Products, devices, and materials for the treatment of chronic and problematic wounds have, during the course of the last two decades, progressed from simple dressings acting as protective coverings to more complex drugs and biological devices."
  October 2003 ,Dermatology Nursing,Dermatology Clinical Trials and Drug Development,Learn more about the drug development process and the role of the nurse.
  October 2003 ,Medscape General Medicine,Understanding Clinical Trials in Context,It is important for clinicians to know about the realities of the world of clinical studies and how to read between the data.
  August 2003 ,American Heart Journal,Most Hospitalized Older Persons Do Not Meet Enrollment Criteria,"A minority of hospitalized older persons with HF fit the profile of populations of clinical trials. There is an urgent need for research in HF for typical HF patients, including the very old."
  June 2003 ,Medscape General Medicine,"Subgroup Analysis, Sex Differences, and Clinical Trials",This report presents some of the current debate  regarding the design of clinical trials and the analysis  of resulting data to accurately and efficiently detect sex  differences.
  February 2003 ,Neurosurgical Focus,Convection-Enhanced Delivery in Clinical Trials,"The poor prognosis associated with malignant primary brain tumors treated with conventional therapies such as surgery, radiotherapy, and chemotherapy has led investigators to develop new innovative therapies."
  November 2008 ,Future Virology,Antiviral Drug Development: Progress and Pitfalls,The 21st International Conference on Antiviral Research witnessed a number of presentations on both novel and well-established viral targets. What are some of the new drug therapies in development?
  November 2008 ,The Medscape Journal of Medicine,The Myth of Equipoise in Phase 1 Clinical Trials,"The continued use of the ethically and scientifically invalid concept of ""equipoise"" in phase 1 clinical research trials undermines the ethics of research with human subjects."
  July 2008 ,Future Neurology,fMRI: Use In Early Alzheimer's Disease And In Clinical Trials,"Functional MRI (fMRI) provides a means to investigate alterations in brain function related to the earliest symptoms of AD, possibly before development of significant irreversible structural damage."
  July 2008 ,Future Virology,Antivirals: Current State of the Art,Antiviral drug development is now progressing at the pace antibiotics were 30 years ago. Learn more about current develops here.
  August 2008 ,Expert Review of Respiratory Medicine,Antituberculous Drug Development and Novel Drug Targets,"A review of the development status of new anti-tuberculous drugs is presented, such as nitroimidazoles, diarylquinolines, diarylquinolines and oxazolidinones."
  August 2008 ,Future Lipidology,Clinical Trials and Surrogate End Points: Lessons From the ENHANCE Trial,ENHANCE trial design and methods are explored in the context of related lipid lowering drug trials.
  June 2008 ,Europace,Anti-arrhythmic Drug Therapy for Atrial Fibrillation,Anti-arrhythmic drug therapy for atrial fibrillation has expanded. Explore the current slate of conventional and non-conventional agents in this thought provoking review.
  June 2008 ,Future Oncology,Status of Therapy for Chronic Myeloid Leukemia: Review of Drug Development,"Chronic myeloid leukemia treatment is relatively effective, but some problems have begun to emerge. Learn what the problems are and how newer generations of CML drug therapies may solve them."
  March 2008 ,Personalized Medicine,The Impact of US FDA Postapproval Tracking on Clinical Pharmacology,"Pending legislation could improve cooperation between drug sponsors, the federal government, and clinicians to ensure that genetic data are considered during crucial stages of drug development."
  February 2008 ,European Heart Journal,The Need for a Consensus Definition,This paper examines issues related to defining heart failure events in cardiovascular clinical trials and presents a definition to formally address this issue.
  January 2008 ,IRB: Ethics & Human Research,"Patient Knowledge, Perception & Likelihood of  Trial Partcipation",The impact of clinical trials is reviewed. What is the likelihood that a person will participate in a clinical trial; what are their perceptions regarding clinical research?
  November 2007 ,PLoS Medicine,Clinical Trials and Medical Care: Defining the Therapeutic Misconception,Therapeutic misconception describes a phenomenon when research participants do not appreciate that research and treatment are different but can a consistent definition be proposed and operationalized?
  September 2007 ,CHEST,Analyzing the Short-term Effect of Placebo Therapy in PAH,"Placebo therapy for pulmonary arterial hypertension (PAH) is common, but debated, in PAH treatment trials. What are the functional, hemodynamic, and clinical effects of placebo in adult PAH patients?"
  September 2007 ,Journal of the American Board of Family Medicine,Understanding the Quality Chasm for Hypertension Control in Diabetes,How can you translate innovations from clinical trials to routine practice to improve hypertension control in diabetes?
  August 2007 ,Nature Clinical Practice Oncology,Molecular Imaging can Accelerate Anti-Angiogenic Drug Development and Test,Angiogenesis is regulated by numerous molecular pathways that could serve as targets for molecular imaging. What is the role of molecular imaging in anti-angiogenic drug development?
  May 2007 ,British Journal of Cardiology,Clinical Trials Versus the Real World:The Example of Cardiac Rehabilitation,Is cardiac rehabilitation as currently practiced in the UK as effective as clinical trials may suggest?
  August 2007 ,Rheumatology,"Vitamins A, C, E and selenium in the treatment of arthritis","A systematic review of randomized clinical trials for the effectiveness of the antioxidant vitamins A, C, E or selenium or their combination in the treatment of arthritis."
  July 2007 ,AIDS,Should We Now Adopt the HIV-RNA < 50 Copy Endpoint for Clinical Trials?,These authors posit that HIV-RNA suppression < 50 copies/ml should be the standard efficacy endpoint in trials of naive and experienced patients as this endpoint has stronger durability over time.
  August 2007 ,IRB: Ethics & Human Research,Who Should Go First in Trials with Scarce Agents? The Views,"Access to drugs not approved by the FDA remains controversial. Even greater access is being called for, but the competing rights of the individual versus the state continue to complicate this issue."
  February 2007 ,Psychopharmacology Bulletin,Simple Options for Improving Signal Detection in Antidepressant Clinical,Effective antidepressants are not distinguished efficiently from placebos using signal detection. Might 3 easy-to-implement methodologies benefit signal detection and clinical trial design?
  November 2009 ,IRB: Ethics & Human Research,Competing Commitments in Clinical Trials,The goals of clinical research and clinical care are often at odds. This survey highlights the potential for clinical commitments of providers to undercut the requirements of research. 
  November 2009 ,Personalized Medicine,Will Personalized Medicine Help in 'Transforming' the Business of Healthcare?,"In order for personalized medicine to have its desired impact, innovative business models will be required to address competing financial interests."
  November 2009 ,Expert Review of Clinical Pharmacology,Novel Antibiotics for the Treatment of Staphylococcus aureus,"A leading cause of nosocomial infections, MRSA is a serious issue for all institutions. What are the newest drug therapies for this often fatal pathogen?"
  November 2009 ,European Journal of Heart Failure,Clinical Trials Update from the ESC Heart Failure Meeting 2009,"Here is information and a commentary on five recent trials with findings relevant to the pathophysiology, prevention, and treatment of heart failure."
  November 2009 ,International Journal of Clinical Rheumatology,What's New in Clinical Trials in Lupus?,"Recent trials have explored the efficacy of old, widely used therapies, as well as newer agents, to prevent lupus flares and for maintenance therapy."
  November 2009 ,Journal of the National Cancer Institute,Prospective Cost-effectiveness Analysis of Cetuximab in Metastatic Colorectal Cancer,Prospectively collected resource utilization and health utility data for patients with CRC in the CO.17 study who received best supportive care +/- cetuximab were assessed for cost effectiveness.
  October 2009 ,Clinical Lung Cancer, Cooperative Group Research Endeavors in Small-Cell Lung Cancer ,"This article discusses the scientific vision of various cooperative groups regarding small-cell lung cancer research, as presented at the 2008 International Lung Cancer Congress (ILCC)."
  October 2009 ,Nanomedicine,Neurodegenerative Disorders and Nanoformulated Drug Development,"Nanotechnology-driven therapies hold the promise of altering the clinical course and outcome of Alzheimer's disease and other common, debilitating and hard-to-treat neurodegenerative disorders.  "
  February 2009 ,Malaria Journal,Clinical Trials to Estimate the Efficacy of Preventive Interventions Against Malaria in Paediatric Populations,"How can trial design be improved and standardized to enable comparative evaluation of malaria control measures in pediatric populations, specifically with respect to the design of malaria vaccine trials?"
  August 2009 ,Annals of Surgery,Use of Emerging Oral Anticoagulants in Clinical Practice,This is an important review of clinical studies of the oral anticoagulants in preventing postoperative venous thromboembolism.
  February 2009 ,Nature Clinical Practice Gastroenterology & Hepatology,How to Critically Appraise an Article,"This review article presents a 10-step guide to the critical appraisal of research literature to assist clinicians in identifying relevant, high-quality studies to guide their clinical practice."
  January 2009 ,HIV Clinical Trials,Preparticipation Information on Posttrial Services of HIV Clinical Trials,Whether patients participate in clinical trials may hinge on whether they’ll receive medications or medical care after the trial ends. How often are retroviral drug trials providing this information?
  June 2009 ,Expert Review of Hematology,Optimal Treatment for Relapsing Patients With Hodgkin Lymphoma,Relapsed/refractory Hodgkin lymphoma (HL) is still a therapeutic challenge. What are some novel investigational treatments for relapsing patients?
  June 2009 ,Faculty of 1000,"A Call for More Transparency of Registered Clinical Trials on Endometriosis. Ranked ""Exceptional"" by F1000",The need for exposure of important research in endometriosisto the medical and public eyes is long overdue.
  May 2009 ,IRB: Ethics & Human Research,An Intervention to Improve Cancer Patients' Understanding of Early-Phase Clinical Trials,Could a computer-based informed consent intervention help clarify patients' expectations about a trial's purpose and benefit? 
  November 2008 ,Neurosurgical Focus,Protection and Repair of the Injured Spinal Cord,This article reviews current clinical trials that could revolutionize management of acute spinal injury.
  January 2009 ,IRB: Ethics & Human Research,Including Persons With Alzheimer Disease in Research on Comorbid Conditions,What is the appropriate balance between protecting Alzheimer patients from the potential risks of research while allowing them to participate in trials that could lead to medical benefit?
  December 2008 ,Kidney International,DRIVE it Home: The Case for Prospective Economic Data Collection in RCTs,The DRIVE and DRIVE-II trials evaluated the efficacy of IV ferric gluconate in anemic dialysis patients but how can we extrapolate these data to change public policy and reimbursement practices?
  November 2008 ,AIDS,HIV Clinical Trial Design for Antiretroviral Development,How can proper clinical trial design affect antiretroviral development?
  November 2008 ,Expert Review of Clinical Immunology,Inhaled Corticosteroids as Rescue Medication in Acute Severe Asthma,The clinical evidence regarding the use of inhaled corticosteroids in acute asthma patients are reviewed.
  January 2010 ,BMC Pharmacology,Antinociceptive Effects of Extracts from Pterodon pubescens ,A Brazilian medicinal plant has pain-relieving properties.
  February 2010 ,Expert Review of Hematology,Autologous Hematopoietic Stem Cell Transplantation in Autoimmune Diseases,"This article discusses the growing experience in the use of HSCT in various autoimmune diseases, including multiple sclerosis, Crohn’s disease, and systemic sclerosis."
  December 2009 ,BMC Clinical Pharmacology,Bioavailability of Different Ibuprofen Preparations,A phase I trial compares the absorption rates of different ibuprofen formulations.
  February 2010 ,AIDS Clinical Care,HIV Outcomes in the Clinic: Now as Good as in Clinical Trials,Example Teaser
  December 2009 ,Expert Review of Hematology,Acute Myeloid Leukemia Stem Cells: Seek and Destroy,This article reviews bench and translational research in leukemic stem cells and discusses how the data should be used to change the direction of developmental therapeutics and clinical trials in AML.
  February 2010 ,Journal Watch,HIV Outcomes in the Clinic: Now as Good as in Clinical Trials,"HIV treatment outcomes have significantly improved over the years, but by just how much?  "
  February 2010 ,Arthritis Research & Therapy,Molecular Therapies for Systemic Lupus Erythematosus: Clinical Trials and Future Prospects,Exploring new pharmacological options and therapeutic avenues for lupus: a focus on non-antibody molecular strategies. 
  January 2010 ,IRB: Ethics & Human Research,Bipolar Mania and Capacity to Consent: Recommendations for Investigators,What is the decisional capacity of individuals with bipolar mania and other mental disorders? 
  January 2010 ,PLoS Medicine,Are Patents Impeding Medical Care and Innovation?,"Is the current patent system actually stimulating biomedical research and innovation, or is it stifling it by raising costs and restricting access?"
  January 2010 ,American Journal of Health-System Pharmacy,Pharmacokinetics of Extended-Release Epidural Morphine Sulfate,How does extended-release epidural morphine compare with standard epidural morphine?
  January 2010 ,BMC Clinical Pharmacology,In Vivo Administration of BL-3050: Highly Stable Engineered PONI-HDL Complexes,A recombinant HDL-associated enzyme and its HDL complex may have a role in treating organophosphate poisoning and atherosclerosis.
  January 2010 ,BMC Pharmacology,Evaluation of Molecular Descriptors for Antitumor Drugs,Understanding chemical properties of these antineoplastic agents may lead to new drug designs.
  December 2009 ,The Nation's Health,New Books Showcase Ethical Issues in Public Health Practice,Ethical issues in public health research and practice now occupy a prominent place in the public health landscape. Two new books provide some guidance for students and professionals.
  December 2009 ,Expert Review of Gastroenterology and Hepatology,Therapeutic Vaccination and Novel Strategies to Treat Chronic HBV Infection,This study focuses on therapeutic vaccination in HBV and discusses potential ways to effect efficient restoration of virus specific immunity in patients with chronic HBV.
  December 2009 ,BMC Clinical Pharmacology,Interactions Between Transdermal Selegiline and Cocaine Infusion,"For potential treatment of cocaine dependence, researchers investigate whether an interaction exists between selegiline and cocaine."
  December 2009 ,The Hastings Center Report,A Tool to Strengthen The Doctor-Patient Relationship,"Comparative effectiveness can ""serve to protect us from our worst impulses and to nurture our very best ones,"" according to the author of this article. "
  December 2009 ,IRB: Ethics & Human Research,Voluntariness of Consent to Research,"Practice-based research networks are burgeoning, and offer an ideal venue for the study of common medical problems, but further maturation is needed for them to fulfill their promise."
  December 2009 ,Journal of the American Board of Family Medicine,Increasing the Role of Practice Networks in Medical Research,"Volunteering for research studies is laudable--and for heart failure patients, it may also be an independent prognostic variable."
  June 2010 ,BMC Clinical Pharmacology,Traumeel S for Pain Relief Following Hallux Valgus Surgery,Traumeel S for Pain Relief Following Hallux Valgus Surgery: A Randomized Controlled Trial
  May 2010 ,U.S. Pharmacist,LASIK Refractive Eye Surgery in the 21st Century,"This surgery is a fast, safe, and cost-effective alternative to glasses and contact lenses."
  May 2010 ,Expert Review of Clinical Pharmacology,Keeping the Rhythm: hERG and Beyond in Cardiovascular Safety Pharmacology,What is the relationship between the hERG ion channel and torsades de pointes?
  May 2010 ,Rheumatology,Lupus Clinical Trials: What Have We Learned So Far?,What treatments are on the horizon for lupus? This review looks at some potential options.
  May 2010 ,Expert Review of Clinical Pharmacology,K+ Channels in the Heart: New Insights and Therapeutic Implications,Will drugs targeting atrial K+ channels have decreased risk of proarrhythmia?
  May 2010 ,The Annals of Pharmacotherapy,Adverse Drug Events in Adult Patients Leading to ED Visits,"How commonly are adverse drug events responsible for ED visits, and which drugs are most often involved?"
  May 2010 ,BMC Clinical Pharmacology,EVITA: A Tool for the Early Evaluation of Pharmaceutical Innovations With Regard to Therapeutic Advantage,This screening tool serves to evaluate the additional therapeutic value of new drugs compared to similar drugs.
  May 2010 ,American Heart Journal,Bridging the Gap Between Clinical Trials of Antiplatelet Therapies and Applications Among Elderly Patients,The paradox of both clotting and bleeding easily keeps elderly patients out of trials studying acute coronary syndromes and peri-PCI treatments. How can extrapolate data for this growing population?
  March 2010 ,Malaria Journal,Engaging Diverse Communities Participating in Clinical Trials: Case Examples From Across Africa,Getting local communities in Africa involved in malaria research can pay big dividends.
  April 2010 ,BMC Pharmacology,BIAdb: A Curated Database of Benzylisoquinoline,A new database may assist those researching drug discoveries based on natural products.
