Date,Source,Headlines,Teaser
  August 2015 ,Age and Ageing,Antidiabetic and Cardiovascular Drugs in T2DM Patients > 80,Are very elderly patients who have recently been diagnosed with diabetes being under- or over-treated?
  August 2015 ,BMC Pulmonary Medicine,Prescribing Long-Acting Inhaled Corticosteroids After SMART,Learn more about related prescription patterns after the SMART trial in Germany.
  August 2015 ,Journal of Medical Case Reports,Fish Oil for Breast Cancer Patients Undergoing Chemotherapy,"Can fish oil supplementation improve the antioxidant status of women undergoing chemotherapy for breast cancer, potentially ameliorating some side effects?"
  August 2015 ,British Journal of Cardiology,VTE in Primary Care: Patient Management With Rivaroxaban,Get guidance on the practical use of rivaroxaban for the treatment of patients with VTE.
  August 2015 ,Annals of Surgery,Circulating Tumor Cells for Esophageal Cancer Prognosis,Can the detection of circulating tumor cells be used as a prognostic staging tool for nonmetastatic esophageal cancer?
  August 2015 ,BMC Public Health,Predictors of Marked Weight Gain Following Smoking Cessation,Many efforts to quit smoking are hampered by concerns of weight gain. But is amount of weight gained really significant in otherwise healthy patients?
  August 2015 ,Liver International,Pharmacogenetic Testing in Drug-Induced Liver Injury,Can genetic testing determine which patients are at risk for drug-induced liver injury?
  August 2015 ,BMC Anesthesiology,Hypothermia-Induced Impairment of Primary Haemostasis,Low dose desmopressin might have the potential to correct hypothermia-induced primary haemostasis impairment under the influence of aspirin during the perioperative period.
  August 2015 ,BMC Clinical Pathology,Podocalyxin-Like Protein Expression in Pancreatic Cancer,This study examined the clinicopathological prognostic and predictive significance of PODXL expression in pancreatic and periampullary adenocarcinoma
  August 2015 ,Annals of Surgery,Synbiotics in Surgery for Chronic Pancreatitis,Can synbiotics reduce complications in patients undergoing pancreatic surgery for chronic pancreatitis?
  August 2015 ,Cardiovascular Diabetology,Glycemic Variability and Cardiac Autonomic Neuropathy In T2D,Does glycemic variability contribute to the development of cardiovascular autonomic neuropathy in patients with type 2 diabetes?
  August 2015 ,BMC Anesthesiology,Epidural/General Anesthesia During Major Abdominal Surgery,Is the combination of general and epidural anesthesia safe and effective in patients with increased intracranial pressure undergoing elective abdominal surgery?
  August 2015 ,Journal of Glaucoma,Vascular Dysfunction in Diabetes and Glaucoma,Find out about the possible association between the development and progression of open-angle glaucoma in diabetic patients and the vascular components that may contribute to this link.
  August 2015 ,American Journal of Cardiovascular Drugs,Long-term Anti-hypertensive Therapy and Stroke Prevention,Which class of antihypertensive agents is superior in reducing the risk of stroke?
  August 2015 ,Eye,Aflibercept in Wet AMD Beyond the First Year of Treatment,Get up-to-date with the most recent expert recommendations for aflibercept therapy in wet AMD after one year.
  August 2015 ,Journal of the American Geriatrics Society,Depression Screening: Pay-for-Performance Indicator?,"The author argues that adherence to depression screening guidelines in primary care is neither cost effective nor associated with better outcomes, hence shouldn't be considered a performance measure."
  August 2015 ,Arthritis Research & Therapy,"Cost-Effectiveness of Abatacept, Rituximab, and TNFi in RA","When TNFi therapy is failing, which biologic agent is most effective and cost-effective for rheumatoid arthritis patients?"
  August 2015 ,Diabetes,A Thrifty Phenotype Associated With Less Dietary Weight Loss,Learn more about this 'thrifty' phenotype and how it may hinder effective weight loss in obese individuals.
  August 2015 ,Current Opinion in Gastroenterology,Nutritional Therapy in Inflammatory Bowel Disease,What is the role of diet in IBD?
  August 2015 ,Journal of the American College of Cardiology,LVADs: A Rapidly Evolving Alternative to Transplant,Left ventricular assist devices are becoming an increasingly prevalent therapy for patients with Stage D heart failure with reduced ejection fraction.
  August 2015 ,BMC Public Health,Herpes Zoster-Associated Mortality in Europe,Is herpes zoster infection significantly associated with mortality in the elderly?
  August 2015 ,American Journal of Kidney Diseases,"Calciphylaxis: Risk Factors, Diagnosis, and Treatment",High-quality evidence for the diagnosis and management of calciphylaxis is lacking. How should a multidisciplinary team go about treating patients with this disease?
  August 2015 ,Cardiovascular Ultrasound,Markers in Elderly Patients With Severe Aortic Stenosis,"Is there a correlation between echocardiographic and biological markers of elevated LV filling pressures in elderly patients with severe, symptomatic aortic stenosis?"
  August 2015 ,Journal of Medical Case Reports,Switching From Imiglucerase to Miglustat for Gaucher Disease,Can the oral substrate reduction agent miglustat be used successfully as maintenance therapy for Gaucher disease type 1 after initial enzyme replacement therapy?
  August 2015 ,Pediatric Critical Care Medicine,Outcomes Associated With Transfusions in Critically Ill Children,Are RBC transfusions associated with better or worse outcomes in critically ill children?
  August 2015 ,International Journal of Impotence Research,Concordance of Sexual Dysfunction and Dissatisfaction,How does one partner's self-reported sexual function and satisfaction compare with the perception of their spouse?
  August 2015 ,Current Opinion in Nephrology and Hypertension,Pathophysiology of the Chronic Kidney Disease-Mineral Bone Disorder,"How does CKD-mineral bone disorder develop, how common is it, and what is the long-term outcome for patients with the disorder?"
  August 2015 ,BMC Clinical Pathology,Extracellular Vesicles: Potential Applications in Cancer,What role might extracellular vesicles play in cancer? Might they be useful as biomarkers or therapeutic targets?
  September 2015 ,Respiratory Research,Cardiac Safety of Tiotropium in Patients With Cardiac Events,How safe is the HandiHaler in COPD patients who've had a recent cardiac event?
  September 2015 ,BMC Urology,Continence After Early Catheter Removal Post-Prostatectomy,Is there an optimal time point for catheter removal after radical prostatectomy? Find out whether earlier removal impacts urinary continence outcomes.
  August 2015 ,BMC Neurology,Switching From Natalizumab to Fingolimod in RRMS,This study aims to improve our understanding of drug-induced immune changes and potential disease exacerbation during switch-over from natalizumab to fingolimod in treatment of RRMS.
  August 2015 ,Journal of the International Association of Providers of AIDS Care,Self-Report Measures in the Assessment of ART Adherence,Do self-reported adherence measures hold clinical value in screening for poor ART adherence?
  August 2015 ,Cancer Control: Journal of the Moffitt Cancer Center,Impact of Molecular Pathology on Classifying Diffuse Gliomas,Learn how molecular pathology has improved precision in defying and grouping gliomas.
  August 2015 ,BMC Oral Health,Signs and Symptoms Associated With Primary Tooth Eruption,Does teething have a direct relationship to systemic symptoms? And what non-pharmacological approaches are effective in relieving teething symptoms?
  August 2015 ,Liver International,Mechanisms of Non-response to Hepatitis C Therapy,How does cirrhosis affect the response to antiviral therapy in patients with hepatitis C?
  August 2015 ,American Journal of Clinical Dermatology,"Hand Dermatitis: Clinical Features, Prevention and Treatment","Hand dermatitis is a common problem, especially prevalent in occupations such as hairdressers, cleaners, healthcare workers, and others. Read about its etiology and current therapies in this review."
  August 2015 ,Current Opinion in Psychiatry,Adolescent Mental Health Service: Is E-Health the Answer?,"While depression and anxiety are common in young people, many do not seek professional help, due to stigma, expense, or availability. Could online interventions be the answer?"
  August 2015 ,Influenza and Other Respiratory Viruses,"Respiratory Syncytial Virus, an Ongoing Medical Dilemma","There is a large, unmet need for the development of vaccines, prophylactics or therapeutics to help combat RSV. Have there been any clinical trials that look promising?"
  August 2015 ,Oncology Nursing Forum,Fatigue Severity and Depression in Older Patients With Cancer,What clues does fatigue provide in older adults with cancer?
  August 2015 ,Clinical Endocrinology,NAFLD and Age Are Indicators for Atherosclerosis in Obesity,A recent study examines nonalcoholic fatty liver disease and age as independent risk factors for carotid atherosclerosis in obese individuals.
  August 2015 ,Kidney International,Chronic Kidney Disease and Heart Disease,What does the latest research tell us about the connections between CKD and heart disease?
  August 2015 ,BMC Surgery,Total Thyroidectomy in the Treatment of Graves' Disease,This study analyzes the results of surgical treatment of patients with Graves' disease.
  August 2015 ,Endocrine Practice,Anti-obesity Pharmacotherapy in Prediabetes to Prevent T2D,Can these anti-obesity agents effectively prevent prediabetes from developing into type 2 diabetes?
  August 2015 ,JAIDS: Journal of Acquired Immune Deficiency Syndromes,ARV Drug Use and HIV Drug Resistance Among HIV+ Black MSM,This report examines ARV drug use and HIV drug resistance among HIV-infected men who have sex with men.
  August 2015 ,Spine,Morbidity and Mortality After Vertebral Fractures,How do the risks of morbidity and mortality compare in vertebral compression fracture patients who received surgical treatment versus those who have been nonsurgically managed?
  August 2015 ,Clinical Gastroenterology and Hepatology,A Proposed New Paradigm for Managing Crohn's Disease,"What is the ""treat to target"" therapeutic strategy in Crohn's disease, and how could it contribute to an improvement in long-term outcomes in patients with the disease?"
  August 2015 ,BMC Musculoskeletal Disorders,Metal Backed Fixed-Bearing Unicondylar Knee Arthroplasties,A new study examines the implant survival rates and functional outcomes in patients treated with this minimally invasive surgical technique for unicondylar knee arthroplasty.
  August 2015 ,BMC Pulmonary Medicine,Staph Aureus and Pseudomonas Infections in Adult CF Patients,How much do specific airway infections impact outcomes in cystic fibrosis?
  September 2015 ,Journal of the American College of Cardiology,Impact of Dual Lipid-Lowering on Coronary Plaque,Find out how ezetimibe and atorvastatin combined impact coronary atherosclerosis in patients undergoing PCI.
  September 2015 ,BMC Ophthalmology,Effectiveness and Costs of Bevacizumab vs Ranibizumab in DME,A new head-to-head trial compares the efficacy and economic value of these two anti-VEGF agents for DME. Which one has the edge?
  September 2015 ,Alimentary Pharmacology & Therapeutics,Effectiveness of Sofosbuvir-based Regimens for HCV Infection,Do sofosbuvir-based regimens bring about sustained virological response in patients with genotype 1 and 2 hepatitis C infection?
  September 2015 ,Journal of Medical Case Reports,Inhibition of IL-1 in Patients With RA and T2DM,Can treatment of rheumatoid arthritis with IL-1 blockade also improve metabolic status in patients with associated Type 2 diabetes?
  September 2015 ,BMC Pulmonary Medicine,Intrabronchial Instillation of Mononuclear Cells in Silicosis,Is bronchoscopic instillation a safe route for bone-marrow derived mononuclear cells in patients with silicosis?
  September 2015 ,Journal of Viral Hepatitis,Therapy for Hepatitis C Genotype 3: Moving Forward,"What drug therapy regimens, with or without interferon, are most effective at treating hepatitis C genotype 3?"
  September 2015 ,BMC Endocrine Disorders,"The Efficacy, Safety of Sitagliptin in the Elderly With T2D",Treatment with the DPP-4 inhibitor sitagliptin may be a safe and effective therapeutic option for elderly patients with type 2 diabetes.
  September 2015 ,Pain Management Nursing,Nonpharmacologic Pain Management in German Nursing Homes,Find out how education on pain-management techniques helps to support patients in managing their pain.
  September 2015 ,Pediatric Nursing,Anger in Adolescent Communities: How Angry Are They?,Learn more about the factors that influence adolescent anger.
  September 2015 ,Chinese Clinical Oncology,Therapies for Melanoma Brain Metastases: Which Drug and When?,Examine the evidence for systemic therapies in patients with active melanoma brain metastasis.
" Open Access Journal of Plastic Surgery,  September 2015 ",ePlasty,Plastic Surgery of the Breast: Keeping the Nipple Sensitive,Find out about the 'unsafe zone' of the breast that should be avoided during reduction mammoplasty in order to preserve nipple sensation.
  September 2015 ,Endocrine Practice,Insulin Sensitizers and Cardiovascular Risk Factors in PCOS,How does treatment with insulin sensitizers affect risk factors for cardiovascular disease in women with PCOS?
  September 2015 ,European Heart Journal,Ablation Strategy for Paroxysmal Atrial Fibrillation,Which ablation strategy provides a longer atrial fibrillation-free period?
  September 2015 ,BMC Anesthesiology,Perioperative Lung Protective Ventilation in Obese Patients,What perioperative protective ventilation strategies should be used on obese patients?
  September 2015 ,Critical Care Medicine,Electronic Tool for Evaluation and Treatment of Sepsis in ICU,Can an electronic tool for sepsis alerts improve compliance with treatment guidelines and clinical outcomes in septic ICU patients?
  September 2015 ,Annals of Oncology,Docetaxel in Metastatic Hormone-Sensitive Prostate Cancer,Does concurrent androgen deprivation therapy plus docetaxel improve survival for some patients with hormone-naive metastatic prostate cancer?
  September 2015 ,Europace,Risk Reduction of Ventricular Tachyarrhythmias in CRT Patients,Find out how mortality risk of CRT-D compares with an ICD alone.
  September 2015 ,Current Opinion in Rheumatology,The Gut Microbiota and Inflammatory Bowel Disease,What features of the mucosal immune system are important in the development and control of inflammatory bowel diseases?
  September 2015 ,AIDS,CD4+ Gain Percentile Curves for Monitoring Response to ART,"Monitoring the percentile curve of CD4+ cell count gain in HIV patients on ART, may help determine subsequent death and virological failure."
  September 2015 ,Journal of the American Board of Family Medicine,Novel Anticoagulants in AF: Primer for the Primary Physician,"Factor Xa inhibitors, direct thrombin inhibitors, aspirin, warfarin--what should you use for AF? Learn their different roles, and how and when to transition from the old to the new, in this guide."
  September 2015 ,Current Orthopaedic Practice,Admission Pathways for Elderly Patients With Hip Fracture,Providing quality and efficient care for these patients may require a multidisciplinary approach.
  September 2015 ,Journal of Cardiovascular Electrophysiology,Sex Differences in Device Therapies in MADIT-CRT,Are women with ischemic heart disease less likely to experience appropriate ICD therapies for ventricular arrhythmias?
  September 2015 ,BMC Oral Health,A Connection Between Sublingual Varices and Hypertension?,"This study suggests that the presence of sublingual varices could be an indicator of hypertension, presenting dentists with a valuable opportunity for screening."
  September 2015 ,Liver International,Non-selective Beta-Blockers May Reduce Risk of HCC,Could beta-blockers help to prevent hepatocellular carcinoma in patients with cirrhosis? This new article explores the research.
  September 2015 ,Seminars in Neurology,The Epidemiology of Posttraumatic Epilepsy,"How great is the risk of posttraumatic epilepsy following traumatic brain injury? And how does it differ, both in presentation and treatment, from other forms of epilepsy?"
  September 2015 ,Current Opinion in Infectious Diseases,Surveillance Systems to Confront Antibiotic Resistance,Read how surveillance systems are essential in combating antibiotic resistance.
  September 2015 ,Alcohol and Alcoholism,Increasing Alcohol Treatment Utilisation Among Inpatients,"Patients with alcohol use disorders who are in the hospital for medical reasons might seem to present an ideal opportunity for intervention, but what type of intervention would be most effective?"
  September 2015 ,Annals of Surgery,Preventing Incisional Hernia in Colorectal Surgery,Incisional hernia is a common complication after colorectal surgery. Would the addition of a prophylactic large-pore polypropylene mesh decrease the incidence of incisional hernia?
  September 2015 ,HIV Medicine,Pre-therapy Inflammation Markers and CD4 Responses to ART,Can pre-ART inflammatory marker levels predicted the CD4 count response to ART?
  September 2015 ,Endocrine Practice,Cinacalcet Treatment in CKD and Hyperparathyroidism,Gain a better understanding of how a regimen of the calcimimetic agent cinacalcet influences plasma adiponectin concentrations in these patients.
  September 2015 ,Current Opinion in Ophthalmology,Anticoagulant and Antiplatelet Drugs in Oculoplastic Surgery,"The perioperative management of patients on anticoagulant or antiplatelet therapy can be challenging, and oculoplastic surgeons must weigh the risks and benefits."
  September 2015 ,European Heart Journal,Effect of the LCZ696 vs Enalapril on Mode of Death in HF,Is LCZ696 superior to enalapril in reducing heart failure deaths?
  September 2015 ,Clinical Journal of Oncology Nursing,Current Perspectives in the Management of Brain Metastases,Find out about novel approaches for treating patients with brain metastases.
  September 2015 ,Journal of the National Cancer Institute,Hematopoietic Transplant Among Elderly With Multiple Myeloma,Has overall survival changed for patients with multiple myeloma who receive hematopoietic stem cell transplantation?
  September 2015 ,BMC Anesthesiology,An Anatomical Study of Lumbar Epidural Catheterization,This study simulated the insertion of epidural catheters in cadaveric specimens to explore the anatomical reasons for epidural catheterization failure.
  September 2015 ,Spine,Epidural Steroid Injection Effects on Postoperative Outcome,Do epidural steroid injections prior to treatment for lumbar spinal stenosis negatively impact treatment outcomes?
  September 2015 ,Annals of Oncology,Stratifying Anticipated Benefit From Anti-Cancer Therapies,Find out more about a new tool from ESMO that's used to determine utility for anti-cancer treatment.
  September 2015 ,Preventing Chronic Disease,Impact of Health Insurance Expansions on Hypertensive Adults,"This study demonstrates that by increasing access to preventive services and lowering out-of-pocket costs of antihypertensive drugs, the Affordable Care Act should improve hypertension management."
  September 2015 ,Clinical Gastroenterology and Hepatology,Pharmacologic Prevention of Pancreatitis After ERCP,Have researchers discovered the best way to prevent post-endoscopic retrograde cholangiopancreatography pancreatitis?
  September 2015 ,Translational Andrology and Urology,Bacille-Calmette-Guerin Non-Responders: How to Manage,What treatment alternatives are available for bladder cancer patients who have failed bacille-Calmette-Guerin therapy?
  September 2015 ,Urologic Nursing,Peyronie's Disease: Overview and Recent Treatment Advances,Learn more about this chronic condition affecting adult males and the negative effects on physical and psychosocial well-being and quality of life.
  September 2015 ,Liver International,Therapeutic Management and Evolution of Chronic HBV,"What type of negative impact does HIV infection have on patients with chronic hepatitis B, and is it changing at all as medications improve?"
  September 2015 ,BMC Psychiatry,Recovery in Lived Experience of Personality Disorders,What does the concept of recovery really mean to people living with personality disorders?
  September 2015 ,European Heart Journal,"Follow-up Duration, Competing Risk and Lifespan-Gain From ICDs",Trial data have shown benefits of these devices but do they make most recipients live longer?
  September 2015 ,American Journal of Public Health,Probability of an Obese Person Attaining Normal Body Weight,Is sustained weight loss without surgical intervention a losing battle for the majority of obese patients?
  September 2015 ,Medicine and Science in Sports and Exercise,Replacing Sitting Time With Different Physical Activities,Find out more about the all-cause and cardiovascular mortality benefits realized by older individuals who replace their sedentary time with a variety of physical activities.
  September 2015 ,Current Opinion in Gastroenterology,Diabetes Associated With Pancreatic Diseases,What does the latest research tell us about the association between diabetes and the risk of pancreatic carcinoma or pancreatitis?
  September 2015 ,Cardiovascular Diabetology,"RAGE and Risk of PAD, Amputation or Death in T2D",What role does the receptor for advanced glycation end products (RAGE) play in the development of PAD and the risk for amputation or death in patients with type 2 diabetes?
  September 2015 ,Annals of Oncology,Adjuvant Trastuzumab Duration for HER-2-Positive Breast Cancer,Find out how the duration of a trastuzumab regimen impacts disease-free survival in HER-2 positive breast cancer.
  September 2015 ,Diabetes Care,Euglycemic Diabetic Ketoacidosis With SGLT-2 Inhibitors,"SGLT-2 inhibitor therapy may be associated with euglycemic diabetic ketoacidosis, and should be used with caution in diabetic patients."
  September 2015 ,Arthritis Research & Therapy,Measuring Disease Activity in Adults With SLE,How can we measure systemic lupus erythematosus disease activity when the disease is known for its variability between patients?
  September 2015 ,International Journal of Impotence Research,Erectile Dysfunction and PDE5 Inhibitor Use,A new study examines the ways in which PDE5 inhibitors may impact the sex lives of older men with erectile dysfunction.
  September 2015 ,American Journal of Epidemiology,Hospitalization Fatality Risk of Influenza A(H1N1)pdm09,This study explores the use of a novel measure--the probability of death associated with H1N1 cases requiring hospitalization--to assess disease severity in the 2009 H1N1 influenza pandemic.
  September 2015 ,European Heart Journal,Role of Neprilysin Inhibitor Combinations in Hypertension,"Get up-to-speed on the mechanism of action, pharmacokinetics, and pharmacodynamics of this novel heart failure drug."
  September 2015 ,The Pediatric Infectious Disease Journal,Neonatal Escherichia coli Bloodstream Infections,Is there an optimal antimicrobial strategy for treating E. coli in the NICU?
  September 2015 ,Cardiovascular Ultrasound,"Carotid Plaque Tissue Characteristics in ACS, Stable Angina","This study demonstrates the utility of the iPlaque system, a novel ultrasound image analysis software that enables the tissue components of carotid plaques to be visualized with high resolution."
  September 2015 ,Journal of the American College of Cardiology,Plaque Characterization by CTA and Acute Coronary Events,Do plaque characteristics by coronary CTA predict mid-term likelihood of acute coronary syndromes?
  September 2015 ,Alimentary Pharmacology & Therapeutics,Progression and Regression of Ulcerative Colitis,What factors are associated with the progression and regression of ulcerative colitis?
  September 2015 ,Journal of the International Association of Providers of AIDS Care,Delaying Initiation of ART for Eligible HIV+ Patients,Why do providers delay ART initiation in clinically eligible patients?
  September 2015 ,BMC Women's Health,Adjuvant Chemo-radiotherapy High Risk Endometrial Cancer,"How safe and effective is sequential chemo-radiotherapy, known as ""sandwich therapy"", for high risk endometrial cancer?"
  September 2015 ,BMC Gastroenterology,Cost-Effectiveness of Sofosbuvir-Based Treatments for HCV,How cost-effective are new sofosbuvir-based regimens compared with other treatment strategies for chronic hepatitis C?
  September 2015 ,Kidney International,The Epigenetics of Acute and Chronic Kidney Disease,"This new article discusses the emerging field of epigenetic therapy, and the evolving role that it could play in the future treatment of renal disease."
  September 2015 ,Journal of Pediatric Psychology,Child Maltreatment and the Adolescent Patient With Severe Obesity,What does this new study tell us about the prevalence and correlates of child maltreatment in adolescents with severe obesity?
  September 2015 ,BMC Neurology,"Latitude, Sun Exposure, and Vitamin D Supplementation in MS","Evidence implicating vitamin D, sun exposure and latitude in the etiology of multiple sclerosis is growing. Do these variables also factor into disease progression and outcome?"
  September 2015 ,BMC Oral Health,Post-Obturation Pain After Non-Surgical Endodontic Treatment,Pain after root canal is common. How does pain incidence and intensity compare after procedures completed in a single visit vs. those completed over multiple visits?
  September 2015 ,BMC Family Practice,Guideline Recommendations About Primary CVD for Older Adults,"Are clinical practice guidelines addressing the specific, more complex needs of older adults when it comes to primary CVD prevention?"
