Date,Source,Headlines,Teaser
  November 2016 ,Alimentary Pharmacology & Therapeutics,Ombitasvir/Paritaprevir/Ritonavir Regimen for Hepatitis C,"This combination drug regimen proved highly effective for treatment of chronic HCV infection, even in difficult-to-treat populations and individuals with advanced disease."
  November 2016 ,Clinical Gastroenterology and Hepatology,Risks of Biological Therapies in Patients With IBD,"Novel biologics have proved effective for improving outcomes in inflammatory bowel disease, but do they increase the risk of developing opportunistic or serious infections and malignancies?"
  November 2016 ,Plastic and Reconstructive Surgery,Antibiotic Prophylaxis Following Breast Reconstruction,Evidence supporting the use of postoperative prophylactic antibiotics after prosthetic breast reconstruction is reviewed.
  November 2016 ,HIV Medicine,Statins and Incident Diabetes in HIV-1 Patients on cART,"The use of statins was not significantly associated with an increased risk of developing incident diabetes mellitus among HIV-1 patients, a new study reports."
  November 2016 ,Journal of the National Cancer Institute,"The Conundrum of Genetic ""Drivers"" in Benign Conditions",Genetic alterations such as HER2 and BRAF can be found in benign conditions. Are tumor suppressors preventing such driver mutations from promoting tumorigenesis?
  November 2016 ,Alimentary Pharmacology & Therapeutics,HCV Therapy in Elderly Patients and Drug-Drug Interactions,"Until the availability of direct antiviral therapies, treatment options in elderly patients with chronic HCV infection were limited. How safe and effective are these agents in patients over 65 years?"
  November 2016 ,Seminars in Respiratory and Critical Care Medicine,Antivirals for Respiratory Viral Infections,Recent years have seen the development of new antiviral agents for respiratory viruses. Where do we stand in finding effective treatment?
  November 2016 ,U.S. Pharmacist,Therapeutic Management of Autoimmune Hepatitis,How does treatment of autoimmune hepatitis differ from that of other etiologies? Learn about current and emerging therapeutic options in this review.
  October 2016 ,American Journal of Transplantation,Blood Transfusion After Kidney Transplantation and DSAs,How does post-transplant blood transfusion impact anti-HLA sensitization and donor-specific antibody development after kidney transplantation?
  October 2016 ,Cancer Control: Journal of the Moffitt Cancer Center,Therapeutic Options for Retinoblastoma,"Over the past decade, localized chemotherapy and targeted drugs have become therapeutic options for retinoblastoma."
  October 2016 ,AIDS,Treatment Interruption After ART During Early HIV in Infancy,"Could HIV-infected infants benefit from a short interruption of antiretroviral therapy, or is continued treatment the better option?"
  October 2016 ,American Heart Journal,Effects of Statins on Mild Noncalcified Coronary Plaque,Do statins slow progression of noncalcified plaque? Does statin intensity change plaque volume over time?
  October 2016 ,Alimentary Pharmacology & Therapeutics,DAAs in Non- and Post-liver Transplant Patients With HCV-1,This study evaluated the effectiveness and tolerability of simeprevir and sofosbuvir in non- and post-transplant HCV-1 infected patients with traditional risk factors for poor treatment response.
  October 2016 ,HIV Medicine,Rosuvastatin vs Protease Inhibitor for Hypercholesterolemia,Is rosuvastatin a safe and effective alternative to protease inhibitor switching for HIV-1 infected individuals with hypercholesterolemia?
  October 2016 ,Current Opinion in Allergy and Clinical Immunology,Allergy Prevention by Breastfeeding,Does breast milk offer protective benefits against the development of allergies? Find out what the evidence says.
  October 2016 ,Alimentary Pharmacology & Therapeutics,Adding Ribavirin to Newer DAA Regimens for HCV-1,Does the addition of ribavirin to regimens comprised of newer direct acting anti-viral agents improve sustained viral response rates in HCV-1 infected persons?
  October 2016 ,Journal for Nurse Practitioners,Direct Oral Anticoagulants: A Patient-Centered Review,Find out what there is to know about the new oral agents for anticoagulation as an alternative to warfarin.
  October 2016 ,Journal of the American Board of Family Medicine,Improving Primary Care Identification and Management of CKD,Could the use of clinical decision support tools help improve the detection and management of CKD in primary care?
  October 2016 ,Nephrology Dialysis Transplantation,Albuminuria Exposure in ARB Therapy Predicts Renal Outcome,A new study explores the prognostic value of individual albuminuria fluctuations after angiotensin receptor blocker initiation.
  December 2016 ,Translational Lung Cancer Research,Histopathological Transformation to SCLC in NSCLC Tumors,Is it time to re-biopsy? Deterioration during targeted therapy may indicate transformation of NSCLC to SCLC.
  December 2016 ,Wounds,Histogram Planimetry Method for Measuring Irregular Wounds,Histogram planimetry may offer an alternative option for measuring the area of irregularly shaped wounds.
  December 2016 ,BMC Anesthesiology,RCTs vs. Observational Studies: Why Not Just Live Together?,"While RCTs are generally regarded as the gold standard to evaluate the efficacy of an intervention, the authors of this commentary make a case for the value of observational studies as well."
  November 2016 ,Endocrine Practice,"AACE, ACE Statement on SGLT-2 Inhibitors and DKA Association",The AACE and ACE issue a position statement regarding the possible increased risk of diabetic ketoacidosis among patients taking SGLT-2 inhibitors.
  November 2016 ,Seminars in Respiratory and Critical Care Medicine,Metastatic Lung Cancer: Emerging Therapeutic Strategies,Have emerging therapies improved patient outcomes in metastatic non-small cell lung cancer?
  November 2016 ,U.S. Pharmacist,A Review of Systemic Lupus Erythematosus,Review the clinical features of SLE and the wide variety of medications and non-pharmacologic therapies which are used to target its symptoms in this primer.
  November 2016 ,American Heart Journal,Cardiac Rehab vs. Usual Care After Catheter Ablation for AF,Does comprehensive cardiac rehabilitation improve outcomes for patients treated with catheter ablation for atrial fibrillation?
  November 2016 ,Clinical Endocrinology,Growth Hormone Enhances Anaerobic Capacity,Growth hormone replacement therapy may help improve physical function and quality of life among GH-deficient adults.
  November 2016 ,Endocrine Practice,The Impact of Age in the Management of Hypothyroidism,Should patient age be a consideration when determining the thyroid-stimulating hormone target for treatment in hypothyroidism?
  November 2016 ,Current Opinion in Gastroenterology,Functional Dyspepsia,"This review summarizes new insights into our understanding of the etiology and epidemiology of functional dyspepsia, and explores recent and emerging advances in treatment."
  November 2016 ,Wounds,Bioimplant Dressing vs Wet Dressing for Diabetic Foot Ulcers,How do these two forms of wound dressings compare in terms of healing diabetic foot ulcers?
  November 2016 ,Clinical Journal of Oncology Nursing,Big Data and Pharmacovigilance: The Role of Oncology Nurses,Find out how oncology nurses can contribute to the safety of newly approved anticancer medications by reporting adverse effects.
  November 2016 ,American Journal of Clinical Pathology,A Clinicopathologic Analysis of Metaplastic Breast Carcinoma,"The authors detail the clinicopathologic features, treatment, and outcomes of 45 patients with metastatic breast cancer; most with high-grade, triple negative disease."
  November 2016 ,Critical Care,Surviving Critical Illness: What Is Next?,A new expert consensus provides guidance for the physical rehabilitation of critically ill patients after hospital discharge.
  November 2016 ,Annals of Family Medicine,Nifedipine vs Placebo for Treatment of Chronic Chilblains,Should nifedipine be prescribed for chilblains? Is it more effective than placebo?
  November 2016 ,Wounds,Surfactant-Based Dressing to Improve Wound Closure Rates,A new surfactant-based antimicrobial wound dressing may help improve outcomes for nonhealing wounds.
  November 2016 ,Journal of the American College of Cardiology,Challenges of Early Feasibility Studies of Medical Devices,"How can the recently enacted U.S. Early Feasibility Study program for medical device testing be optimized to meet the goal of improving access to early-stage, potentially beneficial devices?"
  November 2016 ,American Journal of Public Health,120 000 Nurses Who Shook Public Health,The Nurses' Health Study has contributed enormously to global health -- more evidence that nurses are wonderful.
  November 2016 ,Annals of Oncology,Expectations of AE on Outcomes of Endocrine Treatment,Do negative expectations for endocrine therapy-associated adverse effects increase the risk of nonadherence?
  November 2016 ,Critical Care Medicine,Practice Guidelines for Sustained Neuromuscular Blockade,This article provides updated recommendations for the use of neuromuscular-blocking agents in adult ICU patients.
  December 2016 ,Journal of Cardiovascular Electrophysiology,Single vs. Multiple Ablations in Ventricular Tachycardia,Are multiple catheter ablation procedures necessary in order to achieve long-term clinical success in ventricular tachycardia?
  December 2016 ,Skin Therapy Letter,Ixekizumab for Moderate-to-Severe Plaque Psoriasis,"The anti-IL-17 monoclonal antibody, ixekizumab, is a recently approved biologic therapy for moderate-to-severe plaque psoriasis. What are the findings from the latest clinical trials?"
  December 2016 ,Journal of the American College of Cardiology,Natural History Study of Coronary Atherosclerosis Using FFR,Can stenosis severity as assessed by fractional flow reserve serve as an independent predictor of lesion-related outcome?
  December 2016 ,Clinical Endocrinology,Antithyroid Drugs During Breastfeeding,What do we know about the use of antithyhroid medications during lactation?
  December 2016 ,Journal of Viral Hepatitis,LDV/SOF and Patient-reported Outcomes in HCV/HIV Co-infection,Do HIV/HCV patients treated with the recently approved fixed-dose combination of ledipasvir and sofosbuvir feel the regimen significantly improved their health-related quality of life?
  December 2016 ,American Journal of Transplantation,Outcomes in Belatacept-vs CsA-Treated ECD Kidney Recipients,How did these immunosuppressive regimens measure up in terms of efficacy and safety?
  December 2016 ,Journal of the American Geriatrics Society,Knowledge Gaps in Cardiovascular Care of Older Adults,This joint statement summarizes current guideline recommendations for cardiovascular care as they apply to older adults. What critical knowledge gaps still need to be addressed?
  December 2016 ,Journal of the American Board of Family Medicine,Course of Fluoroquinolones in Outpatient Males With a UTI,Can men with UTIs be successfully treated with a 5-day course of levofloxacin instead of the longer course which is currently recommended?
  December 2016 ,Journal of the American Academy of Orthopaedic Surgeons,Pediatric and Adolescent Forearm Fractures,Current guidelines for managing forearm fractures in children and teens remains controversial. Can these fractures be safely treated nonoperatively?
  December 2016 ,Pain,Opioids for Cancer Patients in the Last Year of Life,Are cancer patients receiving adequate opioid pain control in their last months?
  December 2016 ,BMC Pulmonary Medicine,Tiotropium Respimat vs Tiotropium HandiHaler in COPD,These inhalers provide two options for the delivery of tiotropium in patients with COPD. Find out how they compare.
  December 2016 ,Pediatric Pharmacotherapy,Ketamine Infusions for Pediatric Sedation and Analgesia,Ketamine is commonly used for procedural sedation and analgesia. How safe is it in children?
  December 2016 ,The British Journal of Dermatology,Oral Fumaric Acid Esters for Psoriasis,Are fumaric acid esters safe and effective for the treatment of psoriasis? This Cochrane review examines the best available evidence.
  December 2016 ,Annals of Oncology,Predictors of Chemotherapy Efficacy in NSCLC,"Can biomarkers predict the efficacy of conventional chemotherapy, such as gemcitabine and pemetrexed, for treatment of NSCLC?"
  December 2016 ,Headache,Noninvasive Brain Stimulation and Pain Control in Migraine,"Might noninvasive brain stimulation techniques, such as transcranial magnetic stimulation or transcranial direct current stimulation, provide relief for migraine pain?"
  December 2016 ,Current Opinion in Urology,Immunotherapy in Genitourinary Malignancies,What is our current understanding regarding the use of immunotherapies in the treatment of genitourinary malignancies? Find out what there is to know.
  December 2016 ,Anesthesiology,Better Sleep in the ICU: Blue Pill or Red Pill... or No Pill?,What is the best way to improve sleep in the ICU? Does pharmacologically induced sleep offer more benefit than sedation--or should we be focusing on promoting a non-drug approach?
  December 2016 ,Clinical Gastroenterology and Hepatology,Accuracy of Colon Capsules in Detection of Colorectal Polyps,"Can a new generation of capsule used in colon capsule endoscopy mitigate the criticisms of earlier versions, which were found to have suboptimal accuracy?"
  December 2016 ,Journal of the American Geriatrics Society,Influenza Vaccine Strategies for Elderly Adults,There are now four different influenza vaccines available in the United States for persons aged 65 and older. Are the newer iterations worth their additional cost?
  December 2016 ,Europace,Atrial Fibrillation and Risk of Stroke,Atrial fibrillation is a well-established risk factor for ischemic stroke. But how much of that risk is dependent on concomitant stroke risk factors?
  January 2017 ,Southern Medical Journal,Secondary Stroke Prevention in Nonvalvular AF,"This review offers evidence-based guidance to clinicians on appropriate stroke prevention therapies in patients with nonvalvular atrial fibrillation, along with a cost-effectiveness analysis."
  January 2017 ,Pediatric Pharmacotherapy,Amphetamine Orally Disintegrating Tablets for ADHD,A newly approved extended-release orally disintegrating amphetamine tablet may be another option for the treatment of ADHD.
  January 2017 ,Journal of the American Board of Family Medicine,Avoiding Myalgia With Statin Therapy in Exercising Adults,What's the best strategy for minimizing symptoms of statin-induced myopathy in adults who wish to continue exercising?
  January 2017 ,Wounds,Zinc-Coated Foam With NPWT for Treating Challenging Wounds,The use of zinc-coated foam in conjunction with negative pressure wound therapy was shown to be a safe and effective option in the treatment of challenging wounds.
  January 2017 ,Menopause,Calcium Plus Vitamin D Supplementation and Height Loss,Might calcium along with vitamin D supplementation prevent height loss in postmenopausal women?
  December 2016 ,Southern Medical Journal,Deep Brain Stimulation for Treatment-Refractory Depression,"While deep brain stimulation has shown promise in treating resistant depression, it is still considered experimental. What is the latest evidence regarding its use in depression?"
  December 2016 ,HIV Medicine,"Psychiatric, Substance Use Disorders in HIV/HCV Coinfection",This study looks at the prevalence of psychiatric disorders and substance abuse among coinfected patients. Do the patterns differ according to individual HCV status?
  December 2016 ,Journal of the American Geriatrics Society,Caring for Older Adults With HIV,An increasing number of older adults are HIV positive. How might treatment strategies in this unique population differ from those for their younger cohorts?
  December 2016 ,American Heart Journal,Factors Associated With Diabetes Among Patients With HF,Has the association between diabetes and heart failure been under recognized? This study examined the prevalence of diabetes among US adults hospitalized with heart failure and its impact on outcomes.
  December 2016 ,American Journal of Transplantation,The Current State of Liver Transplantation in the US,Get up-to-date on the current state of knowledge in the field of liver transplantation.
  December 2016 ,Pediatric Nursing,Current Recommendations on Managing Pediatric Concussions,What are the currently recommended strategies for the diagnosis and care of children with concussion?
  December 2016 ,U.S. Pharmacist,Updates in the Management of Seasonal Allergic Rhinitis,Intranasal corticosteroids and oral antihistamines remain the mainstay of treatment for seasonal allergic rhinitis. Review the use of both prescription and OTC options in this report.
  December 2016 ,Southern Medical Journal,Diabetes Mellitus and the Skin,"Cutaneous disease may appear as the first sign of diabetes mellitus, or may develop as a result of microvascular complications. Which skin disorders are most commonly encountered?"
  December 2016 ,The Gerontologist,Pain Management Among Older Patients During Care Transition,Moderate to severe pain remains a common problem among hospitalized older adults. Are they being given adequate pain management when transitioned to skilled nursing facilities?
  December 2016 ,Endocrine Practice,Advances in Clinical Applications of Bone Imaging Technology,Read about the advances in bone imaging technology to aid in the assessment of bone density and fracture risk.
  December 2016 ,Rheumatology,The Gut-Brain Connection,Learn more about the connection between commensal gut bacteria and autoimmune disease.
  December 2016 ,Journal of the American College of Cardiology,Determining When to Add Nonstatin Therapy,"The availability of non-statin cholesterol lowering drugs, such as ezetimibe or PCSK9 inhibitors, has the potential to change lipids management; but for whom should they be prescribed?"
  December 2016 ,Journal of Medical Case Reports,Rivaroxaban for Postoperative DVT of the Lower Limb,"Is rivaroxaban a safe and effective approach to postsurgical deep vein thrombosis after extended, but failed, warfarin therapy?"
  December 2016 ,Europace,Syncope in Patients Paced for Atrioventricular Block,Is cardiac pacing effective in preventing syncope in patients with atrioventricular block?
  December 2016 ,Journal of the American Board of Family Medicine,A Clinical Aid for Detecting Skin Cancer,"A new, simplified dermoscopy algorithm for skin cancer detection can help primary care physicians identify lesions that require skin biopsy or specialist referral."
  January 2017 ,Annals of Surgery,Transfused Blood Age Impacts Outcomes in Major GI Surgery,"The use of older packed red blood cells for transfusion may negatively impact postoperative outcomes of gastrointestinal surgery, a new study reports."
  January 2017 ,Circulation,A Critical Appraisal of Aspirin in Secondary Prevention,This article examines the viability of the continuing role of aspirin in secondary prevention of cardiovascular disease. Is it time to revisit aspirin as the cornerstone of antithrombotic therapy?
  January 2017 ,Critical Care,Association Between Time of ICU Discharge and Mortality,"When it comes to reducing the risk of in-hospital mortality among critically ill patients, does ICU discharge time matter?"
  January 2017 ,Liver International,Ribavirin Revisited in the Era of DAAs for HCV Infection,"What is the role of ribavirin in interferon-free, direct-acting antiviral HCV treatment? For which group of patients might it continue to provide clinical benefit?"
  January 2017 ,HIV Medicine,Adverse Events Leading to Dolutegravir Discontinuation,Might the potential neurotoxicity associated with dolutegravir be the reason for higher discontinuation rates of this antiretroviral agent?
  January 2017 ,Brain,Brain Networks: Robustness and the Impact of Lesions,"Approaching the brain as a complex network, the authors examine what types of damage the brain can withstand--its ""robustness""--and how tumors, stroke and TBI might impact network function."
  January 2017 ,American Journal of Epidemiology,Maternal Influenza Immunization and Adverse Birth Outcomes,Are studies affirming the magnitude of fetal benefit conferred by maternal influenza immunization accurate--or is the methodology flawed?
  January 2017 ,Journal of Clinical Endocrinology & Metabolism,Factors and 25(OH)D Responses to Vitamin D Supplementation,A new study examines how genetic and nongenetic factors may impact responses of vitamin D supplementation.
  January 2017 ,Journal of Clinical Endocrinology & Metabolism,Caloric Restriction Effects on Muscle Mitochondrial Function,"In this study, the changes in muscle mitochondrial function after long-term caloric restriction are evaluated."
  January 2017 ,Journal of Clinical Endocrinology & Metabolism,CLA and Metformin Effects on Insulin Sensitivity,Could metformin and conjugated linoleic acid help improve insulin sensitivity among children with obesity?
  January 2017 ,OJIN: The Online Journal of Issues in Nursing,Why Causal Inference Matters to Nurses,"The authors discuss the importance of causal inference in nursing research, focusing on the causal pathways between nurse staffing and patient outcomes."
  January 2017 ,Circulation,A Protagonist View From the SPRINT Trial,"In this point-counterpoint, the authors make the case for providing older hypertensive patients at high cardiovascular risk with intensive treatment to a target systolic blood pressure of <120 mm Hg."
  January 2017 ,Morbidity & Mortality Weekly Report,Chronic Fatigue Syndrome -- Advancing Research and Education,"This overview addresses the public health impact of myalgic encephalomyelitis/chronic fatigue syndrome, as well as current best evidence as to its cause and clinical approach."
  January 2017 ,Age and Ageing,The Management of Hypertension in People With Dementia,Might antihypertensive therapy do more harm than good in some patients with dementia?
  January 2017 ,Pain,Open-label Placebo Treatment in Chronic Low Back Pain,Can a placebo treatment improve chronic low-back pain--even when the patient is aware that it's a placebo?
  January 2017 ,Alimentary Pharmacology & Therapeutics,BMI >35 Is Associated With Severe C. Difficile Infection,This study examines the correlation between body mass index and C. difficile infection severity.
  January 2017 ,American Journal of Public Health,HPV Vaccination and Prevalence of Cervical Dysplasia,How has the prevalence of low- and high-grade cervical lesions in young women been impacted by the availability of the HPV vaccine?
  January 2017 ,American Heart Journal,Bleeding Risk Following PCI in Diabetic Patients on DAPT,Do patients with diabetes mellitus have an increased risk of bleeding when prescribed dual-antiplatelet therapy following PCI?
  January 2017 ,Journal of the American College of Cardiology,Causes of Death in Anticoagulated Patients With AF,This study aimed to analyze and compare causes of death in patients with atrial fibrillation receiving direct oral anticoagulants or warfarin for prevention of stroke and thromboembolism.
  January 2017 ,AIDS,Real-Life Experience With Sorafenib for HCC in HIV Patients,A new study provides insight into the real-life efficacy of sorafenib among HIV-infected patients with hepatocellular carcinoma.
  February 2017 ,HIV Medicine,"Age, Time Living With Diagnosed HIV, and Self-Rated Health",This new study examines the impact of age at diagnosis and time living with HIV on quality of life among people living with the virus.
  February 2017 ,Endocrine Practice,Hyperthyroidism and Hyperprolactinemia,A new study explores the possible connection between these two conditions in women. What role do prolactin levels play?
  February 2017 ,Urologic Nursing,The Effects of a Take-Home Educational Video,A take-home educational video benefits both prostate cancer patients and urology practitioners. Find out how.
  February 2017 ,Current Opinion in Allergy and Clinical Immunology,Allergen Immunotherapy: An Updated Review of Safety,What does the latest safety data tell us about the use of allergen immunotherapy?
  February 2017 ,AIDS,Early Age at Start of ART for Better Virologic Control,Initiating ART earlier in life may help improve virologic outcomes among infants and children with HIV.
  February 2017 ,Skin Therapy Letter,Brodalumab for Moderate-to-Severe Plaque Psoriasis,"The investigational drug brodalumab, an IL-17 receptor antagonist, has proven highly effective for the treatment of moderate-to-severe psoriasis; but questions remain concerning its safety."
  February 2017 ,Liver International,Hepatotoxicity of Statins and Other Lipid-lowering Agents,How common is liver injury associated with statins? This review summarizes current knowledge on the hepatotoxicity associated with statins and other lipid lowering drugs.
  February 2017 ,Pain,Phenotypes and Treatment Response,"In this commentary, the author examines the role of sensory phenotyping in our effort to understand the underlying pathophysiology of pain. How can these findings be translated to clinical practice?"
  February 2017 ,Journal of Pediatric Health Care,Weight and QoL and Health Outcomes in Children With Asthma,In what ways may weight impact quality of life and health outcomes among children with asthma?
  February 2017 ,Alcohol and Alcoholism,Readiness to Change Predicts Drinking,"This study examined whether three RTC measures--RTC, importance of change, and confidence in ability to change--had predictive value for alcohol use in patients with an alcohol use disorder."
