Date,Source,Headlines,Teaser
  November 2009 ,Medscape Medical News,FDA Approves Pediatric Use of H1N1 Flu Vaccine,"CSL Limited has received approval for an expanded indication for its 2009 H1N1 influenza vaccine, allowing the vaccine's use in children 6 months and older in addition to adults."
  March 2010 ,WebMD Health News,"Refusing to Vaccinate Affects Other Kids, Too","Vaccine refusal fueled san diego's measles outbreak, according to a study."
  March 2010 ,Medscape Medical News,FDA Temporarily Suspends Use of Rotarix Vaccine,Clinicians should stop using the rotavirus vaccine while the agency learns more about components of an extraneous virus detected in the vaccine.
  March 2010 ,Medscape Medical News,CDC Concerned About Spike in Mumps Cases in NY/NJ Hasidic Community,An ongoing outbreak of mumps in the Hasidic (Jewish) community in New York and New Jersey prompted the Centers for Disease Control and Prevention to issue a Health Advisory this week.
  March 2010 ,Medscape Medical News,Complete HPV Immunization Rates Low in the United States,"Only 11% of adolescents aged 13 to 17 years receive all 3 doses of the human papillomavirus (HPV) vaccine, according to a new CDC investigation."
  March 2010 ,Medscape Medical News,Immunizing Children and Teenagers May Protect Entire Community From Influenza,"Study opens up possibility of new strategy in ""herd immunity."" "
  March 2010 ,WebMD Health News,Survey Shows Parents Worry About Vaccines,"Most parents vaccinate their kids, but many still worry about the side effects of vaccines."
  February 2010 ,Medscape Medical News,CDC Advisory Panel Recommends Use of Newly Approved Pneumococcal Vaccine,"The Advisory Committee on Immunization Practices voted to replace Prevnar with Prevnar 13, which provides broader protection for young children against pneumococcal diseases."
  February 2010 ,Medscape Medical News,CDC Advisory Committee Recommends Universal Influenza Vaccination,"All people aged 6 months and older should receive an annual influenza vaccine beginning next flu season (2010-2011), a federal panel of immunization experts says."
  February 2010 ,Medscape Medical News,FDA Advisory Panel Recommends Including H1N1 in Next Seasonal Flu Vaccine,"If the FDA follows the panel's recommendation, it would eliminate the cumbersome 2-vaccine regimen now in place."
  February 2010 ,Medscape Medical News,"Pandemic H1N1 Virus Should Be Added to 2010-2011 Seasonal Flu Vaccine, Says WHO",National public health authorities will decide whether pandemic virus should be included in the traditional trivalent vaccine or given separately.
  February 2010 ,Medscape Medical News,Longer Needle May Be Preferred for HBV Vaccination of Obese Teens,"In a randomized study, use of a longer needle resulted in significantly higher titers in response to hepatitis B virus vaccine among obese adolescents."
  February 2010 ,WebMD Health News,Study Linking Autism to Vaccine Retracted,"The retraction follows the finding of 'dishonest, irresponsible' study methods."
  February 2010 ,WebMD Health News,"Study Linking Vaccine to Autism Broke Research Rules, U.K. Regulators Say","The MMR/autism doctor acted ""dishonestly and irresponsibly,"" a U.K. regulatory panel has ruled."
  January 2010 ,Medscape Medical News,Pentavalent Rotavirus Vaccine May Be Highly Effective Against Severe Disease,A case-control study also shows that even partial immunization against severe rotavirus disease confers substantial health benefits.
  January 2010 ,Medscape Medical News,H1N1 2009 Monovalent Vaccination Recommended for Overall Population,"Now that an ample supply of influenza A (H1N1) vaccine is available, the CDC has expanded the recommendation for vaccination to the rest of the population."
  January 2010 ,Medscape Medical News,"""Cough Trick"" May Reduce Pain of Routine Pediatric Immunizations","On the basis of the results of a randomized controlled trial, a simple ""cough trick"" may be an effective strategy to reduce pain for some children undergoing routine immunizations."
  January 2010 ,Medscape Medical News,Pneumococcal Vaccine Linked to Increase in Serious Lung Complication,"But children should still be vaccinated against bacterial pneumonia, the researchers say."
  January 2010 ,Medscape Medical News,Healthcare Costs Slashed When Allergic Children Receive Immunotherapy,The cost of prescriptions was also reduced by 16% after immunotherapy initiation in children with allergic rhinitis.
  January 2010 ,Medscape Medical News,Parental Varicella Vaccination Refusal Increases Risk for Unvaccinated Children,"Unvaccinated children had 9 times the risk for varicella, including medically attended infection, and immunization refusal may decrease herd immunity."
  January 2010 ,Medscape Medical News,IOM Recommends National Strategy for Hepatitis B and C,"The Institute of Medicine has issued a report recommending a national strategy for the prevention and control of hepatitis B and C viruses, which result in significant mortality."
  June 2010 ,Medscape Medical News,Split-Virus H1N1 Vaccine Offers Children More Immunity Than Whole-Virus Version,"Higher incidence of reactions including pain, soreness, and headache after split-virus vaccine is not alarming."
  May 2010 ,Medscape Medical News,Delaying or Forgoing Childhood Vaccines Offers No Neuropsychological Benefit Down the Road,"A new study should quell fears of parents that infants have ""immune overload"" from early vaccinations."
  May 2010 ,Medscape Medical News,Breast-Feeding Linked to Lower Incidence of Fever After Immunizations,An Italian prospective cohort study shows that breast-feeding is associated with a decreased incidence of fever after immunizations.
  May 2010 ,Medscape Medical News,Oral Sweet Solutions May Reduce Pain of Infant Immunization,A systematic review suggests that infants given sweet solutions before being immunized experience less pain and are more comfortable.
  May 2010 ,Medscape Medical News,"Rotarix or RotaTeq Vaccination May Be Effective, Safe in Childhood",A Cochrane review shows that Rotarix or RotaTeq significantly protects against severe rotavirus diarrhea and hospitalizations without increased serious adverse events.
  May 2010 ,Medscape Medical News,"Coadministration of Gardasil With Menactra, Adacel May Be Safe, Immunogenic","A study shows that coadministration of these vaccines recommended by the ACIP for routine vaccination of adolescents does not reduce safety, tolerability, and immunogenicity."
  May 2010 ,Medscape Medical News,FDA Says Use of Rotarix Should Resume,"Based on a review of available data, the FDA has reversed its recommendation to temporarily suspend use of Rotarix."
  May 2010 ,Medscape Medical News,Rotavirus Vaccine Reduced Gastroenteritis Hospitalizations Among US Children,Introduction of the rotavirus vaccine in 2006 is associated with a substantial decline in US hospitalizations for acute gastroenteritis in infants and young children.
  May 2010 ,Medscape Medical News,ACIP Issues New Guidelines for Use of Combination MMRV Vaccine,A MMWR report offers new recommendations for use of the MMRV vaccine adopted in June 2009 by the Centers for Disease Control and Prevention Advisory Committee on Immunization Practices.
  May 2010 ,Medscape Medical News,"Benefits of Contaminated Rotavirus Vaccine Outweigh Risks, Says FDA Panel","However, committee members recommend further studies on possible long-term risks. "
  May 2010 ,Medscape Medical News,Pertussis Vaccination Triggers Dravet Syndrome in Predisposed Children ,"Pertussis vaccination may trigger earlier onset of Dravet syndrome in some children predisposed to develop the disease, but this does not affect their clinical outcome."
  May 2010 ,Medscape Medical News,Pandemic Flu and Vaccine Development,A presentation at NAPNAP's annual meeting described the most current information related to the flu pandemic and development processes for the H1N1 vaccines.
  April 2010 ,Medscape Medical News,Neonatal Vitamin A Supplementation and Response to Pediatric Vaccination,"Vitamin A supplementation in children between 6 months and 5 years was associated with excess female mortality, particularly when diphtheria-tetanus-pertussis vaccine was the most recent vaccine."
  April 2010 ,Medscape Medical News,Exposure to Children Linked to Lower Risk for Bacteremic Pneumococcal Disease ,A study suggests that new serotypes are replacing the serotypes covered in the conjugate vaccine and that the dominant modes of transmission in the community are changing.
  April 2010 ,Medscape Medical News,Reports of Guillain-Barré Syndrome Low After 2009 H1N1 Vaccination ,"New numbers from the CDC/FDA Vaccine Adverse Event Reporting System suggest that cases of GBS are low, but investigators stress that passive surveillance generally underestimates the risk.  "
  April 2010 ,Medscape Medical News,Flu Shot Without Skin Testing May Be Safe for Egg-Allergic Patients,"A study suggests that patients without anaphylaxis to egg may safely receive the influenza vaccine in a 2-dose, graded fashion without a vaccine skin test."
  April 2010 ,Reuters Health Information,"Early-Life Infections, Immunizations Alter Childhood Asthma Risk","Combined diphtheria and tetanus immunization in the first year may be a risk factor for asthma, but the need for immunization may also be a marker of increased risk for asthma in later childhood."
  April 2010 ,Medscape Medical News,Rates of US Pandemic Influenza Vaccination Are Lowest in the South,Hard-hit Georgia is at the bottom of the list for immunizing children and fifth from the bottom for all individuals.
  April 2010 ,Medscape Medical News,Healthcare Workers Less Often Vaccinated Against H1N1 Than Seasonal Flu,Only two thirds of healthcare workers view the pandemic influenza vaccine as safe.
  March 2010 ,Medscape Medical News,Boys and Young Men Who Lack Mumps Vaccinations Are at Risk for Lower Fertility,Vaccinations are urged for those boys and young men who were not inoculated as children.
  September 2010 ,Medscape Medical News,Further Evidence Shows No Link Between Thimerosal and Increased Autism Risk ,A case-control study finds no evidence that increasing thimerosal exposure is associated with increased risk of autism outcomes.
  September 2010 ,Medscape Medical News,Pneumococcal Vaccine in Childhood Does Not Reduce Adult Hospitalizations ,"A 2004 government vaccine program for children failed to have an impact on adult hospitalizations for pneumonia over the subsequent 3 years, according to a Canadian study."
  August 2010 ,Medscape Medical News,"Mandate Flu Vaccination for Healthcare Workers, Say Infectious Disease Experts","Required vaccination at several healthcare organizations has boosted their workforce immunization rates past the 98% mark, according to a position paper from the Society for Healthcare Epidemiology of America."
  August 2010 ,Medscape Medical News,CDC No Longer Recommends Delaying Influenza Vaccination for Elderly,A CDC official says there is no evidence that elderly patients gain more protection against influenza by waiting until October or November to get immunized.
  August 2010 ,Medscape Medical News,Guidelines for Influenza Vaccination and Antiviral Therapy in Children,The American Academy of Pediatrics has updated guidelines for use of trivalent seasonal influenza vaccine and antiviral medications to prevent and treat influenza in children.
  August 2010 ,Medscape Medical News,CDC: Adolescent Vaccinations Increased Substantially From 2008 to 2009,"Vaccination coverage among adolescents aged 13 to 17 years increased from 2008 to 2009, although considerable variability exists among states; there is still room for improvement, particularly against pertussis."
  August 2010 ,Medscape Medical News,"Live Oral Pentavalent Rotavirus Vaccine May Be Safe, Effective in Developing Countries",Randomized controlled trials in Asia and Africa show that this rotavirus vaccine is as safe and effective for preventing severe rotavirus as it is in middle-high income nations.
  August 2010 ,Medscape Medical News,Pediatric Virologist Robert Chanock Dead at 86,His discoveries of childhood respiratory viruses led to the development of several important vaccines.
  August 2010 ,Medscape Medical News,Physicians Avoid Recommending HPV Vaccine in Girls Aged 11 to 12 Years,"According to a new survey, US physicians appear to be reluctant to offer the human papillomavirus vaccine to girls aged 11 to 12 years, as recommended in national guidelines."
  August 2010 ,Medscape Medical News,ACIP Updates Guidelines for Prevention and Control of Influenza With Vaccines,The Advisory Committee on Immunization Practices has issued new 2010 recommendations for prevention and control of influenza with vaccines.
  August 2010 ,Medscape Medical News,"Fevers, Febrile Seizures Higher After Afluria Vaccination in Children Below Equator ",The seasonal influenza vaccine Afluria contains a strain of the pandemic 2009 H1N1 virus.
  July 2010 ,Medscape Medical News,DTaP in Early Childhood Not Linked to Increased Seizure Risk Within 3 Days,"Within 3 days after receipt of the diphtheria-tetanus-acellular pertussis vaccine in early childhood, there was no increased risk for seizures."
  July 2010 ,Medscape Medical News,Animal Study Shows Potential of Universal Influenza Vaccine,A primer dose followed by a periodic booster could eliminate the need for annual influenza vaccinations.
  July 2010 ,Reuters Health Information,Tdap Vaccine Protects Against Pertussis During Outbreak,"The Tdap vaccine (a tetanus, reduced-dose diphtheria, and acellular pertussis booster) effectively protected adolescents during a pertussis outbreak in the US Virgin Islands in 2007."
  July 2010 ,Medscape Medical News,California Promotes Adult Vaccination to Combat Pertussis Epidemic ,"Other states are reporting more cases of whooping cough than usual, although the nation as a whole is experiencing less disease activity."
  July 2010 ,Medscape Medical News,Use of Pentavalent Rotavirus Vaccine Linked to Reduction in Gastroenteritis,Increased use of pentavalent rotavirus vaccine in a pediatric practice was linked to fewer acute gastroenteritis visits and hospitalizations among immunized children and older groups.
  June 2010 ,Medscape Medical News,MMRV Doubles Risk for Febrile Seizures 7 to 10 Days After Vaccination,"A new study suggests the vaccine causes 1 additional seizure for every 2300 doses with the combination vaccine, so the risk is still low, researchers note. "
  June 2010 ,Medscape Medical News,"ACIP Votes to Change Recommendations for Meningococcal, Flu Vaccines","The committee recommended changes to warnings about the risk for Guillain-Barre syndrome after meningococcal vaccination, and also a change in dosing for children who receive the seasonal influenza vaccine."
  June 2010 ,Medscape Medical News,Early-Life Exposure to PCBs Linked to Lower Vaccination Response,"In a cohort study, early-life exposure to polychlorinated biphenyls was associated with reduced diphtheria and tetanus antibodies after vaccination. "
  June 2010 ,Medscape Medical News,Rotavirus Vaccine Contraindicated in Infants With SCID,"The Centers for Disease Control and Prevention has announced that rotavirus vaccine, both monovalent and pentavalent products, should not be used in infants with severe combined immunodeficiency."
  December 2010 ,Medscape Medical News,Financial Barriers Lower Pediatric Use of Combination Vaccines ,New survey shows 1 in 5 pediatricians cite inadequate payment as the reason for not administering 1 or more combination vaccines.
  December 2010 ,Medscape Medical News,CDC Recommends Flu Vaccine for Everyone Aged 6 Months and Older,"This week is National Influenza Vaccination Week, and the CDC is emphasizing the importance of influenza vaccination for everyone aged 6 months and older."
  November 2010 ,Medscape Medical News,Trivalent Inactivated Influenza Vaccine May Prevent Influenza in Children Younger Than 2 Years ,"Because trivalent inactivated influenza vaccine effectively prevents influenza in young children, including those younger than 2 years, countries should reassess influenza vaccine recommendations. "
  November 2010 ,Medscape Medical News,FDA Panel Recommends HPV Vaccine for Anal Cancer Prevention,The advisory panel voted in favor of expanding the indication of quadrivalent human papillomavirus recombinant vaccine for preventing anal cancer in young adults. 
  November 2010 ,Medscape Medical News,"Intervention to Reduce Pain, Anxiety of Immunization Feasible in Pediatric Practices","After 1 hour training on techniques to reduce the pain and anxiety associated with immunization, pediatric practices continued using the techniques at 6 months. "
  November 2010 ,Medscape Medical News,HPV Vaccination of Young Women May Protect Men Through Herd Immunity ,"High coverage of HPV vaccination in young Australian women resulted in lower frequency of genital warts, which might protect heterosexual men through herd immunity. "
  November 2010 ,Medscape Medical News,Malaria Vaccine Safe and Effective in Infants,"A malaria vaccine candidate, RTS,S/AS01E, the furthest along in clinical development, demonstrated safety and efficacy in a phase 2 trial of infants."
  November 2010 ,Medscape Medical News,Most HPV Vaccinations Not Completed in Urban Study,Young adults are the age group least likely to complete the 3-dose vaccination course for human papillomavirus (HPV).
  October 2010 ,Medscape Medical News,CDC Panel Recommends Changes to 2011 Immunization Schedules,The Advisory Committee on Immunization Practices approved changes to both the child and adult 2011 immunization charts.
  October 2010 ,Medscape Medical News,ACIP Now Recommends Tdap Vaccine at Age 65 Years and Older ,ACIP has recommended a booster vaccination with the Tdap vaccine in people between the ages of 11 and 64 years and for those older than 65 years if they come in close contact with infants.
  October 2010 ,Medscape Medical News,ACIP Recommends Meningococcal Booster Dose ,The Advisory Committee on Immunization Practices has voted in favor of a second meningococcal vaccine dose given within 5 years of the first dose.
  October 2010 ,Medscape Medical News,H1N1 Influenza Vaccine Safe for Pregnant Women,"Pregnant women receiving the H1N1 flu vaccine had no more adverse effects than unvaccinated women, except for arm soreness. Obstetrical providers' recommendation was a strong driver of vaccination."
  October 2010 ,Medscape Medical News,Secondhand Smoke and Hospitalization Risk in Young Children With Influenza,"Secondhand smoke, a young mother, and comorbidities raise the risk for hospitalization in young children with influenza; vaccination of household members halved the risk."
  October 2010 ,Medscape Medical News,"Kids at High Risk for Severe Illness, Death Should Get Flu Vaccination Priority","In a UK study, children at highest risk for influenza-related complications were ethnic minorities and those with specified preexisting disorders. "
  October 2010 ,Medscape Medical News,Hepatitis B Virus Immunity Often Compromised in Children on Biologics,"Despite vaccinations, children receiving infliximab often have inadequate immunity against hepatitis B virus infection."
  October 2010 ,WebMD Health News,Flu Shots OK for People With Egg Allergy,"The American Academy of Allergy, Asthma & Immunology says a few have reactions to the flu vaccine."
  October 2010 ,Medscape Medical News,Most Physicians Plan to Get Influenza Vaccine,"The survey of 400 primary care physicians, including 100 pediatricians, found that 95% say they have been or plan to get vaccinated against seasonal influenza this year."
  October 2010 ,Medscape Medical News,Maternal Influenza Vaccination May Protect Infants From Flu,Maternal influenza vaccination was significantly associated with reduced risk for influenza infection and hospitalization in infants up to 6 months of age. 
  September 2010 ,Medscape Medical News,Rotarix Label Has New Warning About Risk for Bowel Abnormality,The increased risk for intussusception was the reason that a different rotavirus vaccine was withdrawn from the market in 1999.
  September 2010 ,Medscape Medical News,Pneumococcal Vaccine Dosing Schedule Linked to Higher Risk for Multiresistant Strain,"Compared with unvaccinated control subjects, patients given a 2 + 1-dose 7-valent pneumococcal conjugate vaccination schedule had an increase in serotype 19A nasopharyngeal acquisition."
  April 2011 ,Medscape Medical News,Parents' Vaccine Safety Concerns Dominate Office Visits,"Parental safety concerns about vaccines are taking up a growing proportion of physicians' time, according to a new study."
  March 2011 ,Medscape Medical News,AAP Endorses CDC's Rabies Vaccine Dose Regimen,The Advisory Committee on Immunization Practices recommends lowering the number of doses from 5 to 4 of human diploid cell vaccine or purified chick embryo cell vaccine to prevent human rabies.
  March 2011 ,Reuters Health Information,Japan Panel Finds No Link to Vaccine Deaths: Kyodo,"A panel of experts at Japan's health ministry found no direct link between vaccines made by Pfizer Inc and Sanofi-Aventis SA and the deaths of children, but said further checks were needed, Kyodo news agency reported on Tuesday."
  March 2011 ,Reuters Health Information,"Japan Halts Prevenar, ActHIB Vaccines After Four Children Die",Japan's health ministry has halted the use of vaccines made by Pfizer Inc and Sanofi-Aventis SA to prevent meningitis and pneumonia following the deaths of four children.
  February 2011 ,Medscape Medical News,"Coadministration of Flu, Pneumococcal Vaccines Linked to Febrile Seizures",CDC's Advisory Committee on Immunization Practices (ACIP) discusses febrile seizures associated with vaccine use.
  February 2011 ,Medscape Medical News,ACIP Reviews Upcoming Vaccine Shortages,The Advisory Committee on Immunization Practices provides update on vaccine supply in the coming months.
  February 2011 ,Medscape Medical News,High Court Protects Vaccine Makers for 'Unavoidable' Adverse Events,"Parents still have recourse through the federally mandated ""Vaccine Court."""
  February 2011 ,Medscape Medical News,National Plan Gives Shot in the Arm to Immunization Efforts,The US Department of Health and Human Services has unveiled a 10-year strategy to boost vaccine accessibility.
  February 2011 ,Medscape Medical News,"Public, Physicians Paying More Attention to Flu Shots","Hot on the heels of the H1N1 influenza pandemic, new research suggests physicians and the public seem to be getting the message about the importance of universal influenza vaccination."
  February 2011 ,Medscape Medical News,Risk for Local Reaction to Fifth Dose of DTap Vaccine Higher With Arm Injection,Risk for a local reaction to the fifth dose of the diphtheria and tetanus toxoids and acellular pertussis vaccine is significantly higher when it is injected in the arm.
  February 2011 ,Reuters Health Information,Some Vaccines Might Protect Kids Against Leukemia,"Kids who have had certain vaccines might be less likely to develop cancer, especially one type of leukemia, suggests a new study."
  February 2011 ,Medscape Medical News,AAP Issues Recommended Childhood and Teen Immunization Schedules,The 2011 recommended childhood and adolescent immunization schedules have been released by the American Academy of Pediatrics and approved by several other organizations.
  January 2011 ,Medscape Medical News,Adult Immunization Schedule for 2011 Released,"Changes in the 2011 adult immunization schedule include a permissive recommendation for use of the tetanus, diphtheria, pertussis vaccine in adults 65 years or older."
  January 2011 ,Medscape Medical News,Recommendations on Use of Meningococcal Conjugate Vaccines Updated,The Advisory Committee on Immunization Practices has updated its recommendations for use of meningococcal conjugate vaccines.
  January 2011 ,Medscape Medical News,FDA/CDC to Study Increase in Febrile Seizures After Flu Vaccination ,"The seizures have occurred mostly in children younger than 2 years. Nearly all children experiencing febrile seizures quickly recover with no lasting aftereffects, the FDA notes."
  January 2011 ,Medscape Medical News,"Medical Establishment Buried Concerns About MMR/Autism Study, BMJ Charges","In the last of 3 articles, BMJ reports the medical community ""scrambled"" to discredit concerns and failed to investigate allegations raised about a study linking the MMR vaccine to regressive autism."
  January 2011 ,Medscape Medical News,ACIP Updates Guidelines for Use of Tdap Vaccine,"Vaccination with tetanus toxoid, reduced diphtheria toxoid, and acellular pertussis is the best way for adolescents and adults to protect themselves and others against pertussis, with a 1-time dose."
  January 2011 ,Medscape Medical News,Varicella Vaccination Reduces Hospitalizations ,Varicella-related hospitalizations have declined by more than 65% in all age groups since the vaccine program began.
  January 2011 ,Medscape Medical News,"Autism and MMR Vaccine Study an 'Elaborate Fraud,' Charges BMJ","BMJ charges that a small study published in The Lancet that linked MMR vaccine to regressive autism was more than just carelessness but actually ""an elaborate fraud."""
  December 2010 ,Medscape Medical News,Gardasil Gets FDA Nod for Prevention of Anal Cancer ,"Already approved for the prevention of cervical, vulvar, and vaginal cancer, Gardasil is now approved for the prevention of anal cancer by the FDA in human papillomavirus types 6, 11, 16, and 18. "
  April 2012 ,Medscape Medical News,Measles Vaccines Not Associated With Febrile Seizure Risk ,A large study finds no significant increase in febrile seizures among children taking the combination MMRV vaccine compared with those taking MMR followed by a separate varicella vaccine.
