Date,Source,Headlines,Teaser
  January 2012 ,Reuters Health Information,Most Toddler Vaccines Not Linked to ITP,"Although the MMR vaccine has been linked to a heightened risk of immune thrombocytopenic purpura (ITP), other vaccines in the toddler years do not appear to be."
  January 2012 ,Medscape Medical News,No Intussusception Rise Seen With Vaccine Reintroduction ,"Updated rotavirus vaccines are not associated with an increased risk for the severe bowel obstruction that was associated with the previous rotavirus vaccine, according to results of a new study."
  December 2011 ,Medscape Medical News,"Novel Swine Flu Virus Now Reported in 5 States, Says CDC","Since July, 12 patients have caught a swine influenza virus that borrows a gene from the 2009 pandemic virus. In 2 states, the virus apparently spread from person to person on a limited basis. "
  December 2011 ,WebMD Health News,Study: HPV Vaccine Doesn't Encourage Risky Sexual Activity,A CDC survey shows no evidence that the HPV vaccine encourages risky behavior among adolescents and young women.
  November 2011 ,Medscape Medical News,Combination Vaccine Reimbursement Pain Eased With New Codes,Some physicians must still choose between hurting their patients or their pockets.
  November 2011 ,Medscape Medical News,Single Flu Shot Safe for Kids With Egg Allergy,"Giving the trivalent influenza vaccine to children with severe egg allergy in a single dose is safe and well tolerated, according to interim results of a 2-year study."
  October 2011 ,Medscape Medical News,"Do Not Give Flu Vaccine by Jet Injection, FDA Says","Although several jet-injection devices are approved for delivering vaccines and other medications, no influenza vaccine has been cleared for this method of administration."
  October 2011 ,Medscape Medical News,Rotavirus Vaccine Benefits Now Far Outweigh Risks,Risk-to-benefit ratios strongly support the use of current vaccines against rotavirus to prevent gastroenteritis in young children. 
  October 2011 ,Medscape Medical News,Can You Teach New Docs Old Tricks?,"Younger primary care providers are more likely than their older counterparts to believe that vaccines do more harm than good, according to a new study."
  October 2011 ,Medscape Medical News,California Minors No Longer Need Parental  Okay for HPV Shot,California physicians and nurses rallied behind the new law that some social conservatives construe as sidestepping parental supervision.
  October 2011 ,Medscape Medical News,Parents Often Shun Recommended Childhood Vaccine Schedule,Parents weigh perceived low disease risk vs perceived high risk for side effects.
  September 2011 ,Reuters Health Information,Doctors' MMR Support Key to Halting Measles in EU,"With almost 30,000 cases of measles and eight deaths from the disease recorded in the European Union so far this year, a leading health official is urging doctors to do more to ensure parents have their children vaccinated with MMR."
  September 2011 ,Medscape Medical News,AAP Updates Polio Vaccine Recommendations,"If a child is at imminent risk for exposure, with planned travel to certain countries, the AAP  recommends that the IPV doses be administered at minimum ages and intervals."
  September 2011 ,Medscape Medical News,"Bioethicists Offer $11,000 for Proof of HPV Vaccine Story",A pair of bioethicists have challenged Congresswoman Michele Bachmann to provide evidence that vaccination for HPV causes mental retardation.
  August 2011 ,Medscape Medical News,Updated Influenza Vaccine Recommendations Issued,US health officials have released updated guidance on the use of the influenza vaccine in the United States for the 2011-2012 season. 
  July 2011 ,Medscape Medical News,Preterm Infants May Receive 10-Valent Pneumococcal Vaccine,The 10-valent pneumococcal nontypeable Haemophilus influenzae protein D conjugate vaccine (PHiD-CV) was well tolerated and immunogenic in preterm infants when given as a 3-dose primary vaccination.
  July 2011 ,Medscape Medical News,Flu Vaccines for 2011-2012 Season Receive FDA Approval ,The FDA has approved a trivalent formulation of the influenza vaccine for the 2011 to 2012 influenza season.
  June 2011 ,Medscape Medical News,Rotavirus Vaccine Reduces Gastroenteritis Hospitalizations ,"In 3 US counties from 2006 to 2009, use of rotavirus vaccine was associated with greatly reduced gastroenteritis hospitalizations in children. "
  June 2011 ,Medscape Medical News,'Decade of Vaccines' Will Save Lives and Money Globally,"Vaccines are projected to save the lives of more than 6 million children and spare an estimated $231 billion in treatment and related costs in the next decade, according an analysis of the ""Decade of Vaccines"" project."
  January 2013 ,Medscape Medical News,AAP Issues 2013 Child/Adolescent Immunization Schedule,"The American Academy of Pediatrics has issued the 2013 child/adolescent immunization schedule, including a new recommendation to give Tdap vaccine to adolescents and pregnant women. "
  January 2013 ,Medscape Medical News,Nearly Half of Children Fail to Receive Vaccines on Schedule,Fewer parents each year follow the recommended vaccination schedules for their infants and toddlers. 
  January 2013 ,Medscape Medical News,IOM Supports Safety of Childhood Immunization Schedule,An IOM expert panel reviewed feedback from stakeholders and the literature and found no convincing evidence of increased risk linked to the current vaccine schedule for children up to 6 years of age. 
  January 2013 ,FDA Approvals,"FDA Okays Novel Flu Vaccine Made Without Eggs, Viruses","The new vaccine, Flublok, also dispenses with mercury-containing thimerosal and antibiotics."
  January 2013 ,Medscape Medical News,Diphtheria Vaccine Administered in the Thigh Appears Safer ,A new study of 1.4 million children shows less risk for local reaction among those given the diphtheria vaccine in the thigh rather than the arm.
  December 2012 ,Medscape Medical News,Thimerosal for Vaccines: AAP Endorses WHO Statement ,The World Health Organization asks for thimerosal exemption in a United Nations Environmental Program treaty under development for limiting mercury exposures worldwide. 
  December 2012 ,FDA Approvals,FDA Okays 4-Strain Seasonal Influenza Vaccine,Fluarix Quadrivalent is the first intramuscular vaccine to protect against 2 A virus strains and 2 B virus strains. 
  November 2012 ,Medscape Medical News,Meningococcal Conjugate Vaccine Appears Safe in Infants ,A pooled analysis suggests that a 2-dose series of MenACWY-D appears to be safe and immunogenic when given at ages 9 and 12 months. 
  October 2012 ,Medscape Medical News,ACIP Approves Revised MMR Recommendations ,The CDC's Advisory Committee on Immunization Practices has updated the recommendations for at-risk groups and postexposure prophylaxis. 
  October 2012 ,Medscape Medical News,Pap Tests Less Frequent Under New Guidelines ,The American College of Obstetricians and Gynecologists has issued new guidelines for cervical cancer screening. 
  October 2012 ,Medscape Medical News,HPV Vaccine Does Not Increase Sexual Activity ,Girls who received the human papilloma virus vaccine at 11 or 12 years of age were no more likely to engage in sexual behavior than girls who did not receive the vaccine.
  September 2012 ,Medscape Medical News,Pertussis Vaccine Protection Wanes Year by Year,"The more recent the vaccine, the stronger the protection against whooping cough."
  September 2012 ,Reuters Health Information,EU Advises All Girls Need Cervical Cancer Vaccines,"All girls in Europe should be immunized against the human papillomavirus (HPV) and current vaccine coverage rates are far too low, European Union health officials have announced."
  August 2012 ,Medscape Medical News,Influenza Vaccination Schedule for Children Updated,New recommendations also provide information on the 2012-2013 vaccine strains and support use of the trivalent inactivated influenza vaccine in persons with mild egg allergies. 
  August 2012 ,FDA Approvals,Latest Flu Vaccine Again Guards Against Pandemic Virus,"The trivalent seasonal influenza vaccine for 2012-2013 contains the same pandemic virus used in vaccines since 2010-2011. It does not guard against H3N2v, the novel swine influenza virus currently in the news."
  August 2012 ,Medscape Medical News,Wakefield's Libel Suit Against BMJ Thrown Out,"A judge has thrown out the libel action suit filed in Texas by Andrew Wakefield against the BMJ, the journal's editor, and investigative journalist Brian Deer."
  July 2012 ,Reuters Health Information,U.S. Pertussis Outbreak Could Be Worst in Half Century,"The number of U.S. whooping cough cases has risen to around 18,000 in an outbreak that is on track to become the most severe in over a half century and could stem from possible waning vaccine protection."
  July 2012 ,Medscape Medical News,California Pertussis Epidemic Reveals Vaccine Gap,"The 2010 California pertussis epidemic sickened 9000, killed 10, and revealed a vaccine gap dangerous to the youngest infants."
  June 2012 ,Medscape Medical News,"New ACIP Recommendations on Pneumococcal, Influenza Vaccines",The Advisory Committee on Immunization Practices voted to recommend the addition of PCV13 to PPSV23 for immunocompromised adults and to recommend a second dose of influenza vaccine for some children.
  May 2012 ,Medscape Medical News,Big Pediatric Offices Linked to Lower Flu Vaccination Rates,Every 10-fold increase in the number of total patients was linked to a decrease of 20% or more in patients vaccinated.
  December 2013 ,Medscape Medical News,Acellular Pertussis Vaccine May Not Prevent Transmission,"In a primate model, acellular pertussis vaccines protected against disease but did not prevent infection and transmission, whereas whole-cell vaccines were more effective."
  November 2013 ,Medscape Medical News,A Review of Barriers to HPV Vaccination Among Teens ,"A new study has found that barriers to HPV vaccination among US adolescents range from financial and social issues to parental attitudes, and highlights the need for better vaccine education."
  November 2013 ,Medscape Medical News,Pediatricians' Verbal Cues Affect Decision to Vaccinate,The approach a physician used to discuss vaccinations played a significant role in whether or not parents chose to have their child vaccinated at that visit.
  October 2013 ,Medscape Medical News,ACIP Approves 2014 Child/Adolescent Immunization Schedule,The CDC's Advisory Committee on Immunization Practices unanimously approved the 2014 Child/Adolescent Immunization Schedule today.
  October 2013 ,Medscape Medical News,ACIP OKs Meningitis Vaccine (Menveo) for High-Risk Infants,The CDC's Advisory Committee on Immunization Practices has recommended a meningococcal conjugate vaccine for infants and young toddlers at increased risk for meningococcal disease.
  October 2013 ,Medscape Medical News,Measles: First Dose at 12 Months May Erode Potency Later,Children who received their first measles shot at age 12 to 13 months had a 6-fold increased risk of contracting the disease during an epidemic compared with infants first vaccinated at age 15 months.
  October 2013 ,Medscape Medical News,New Survey Sheds Light on Low HPV Vaccination Rate,Many parents of teen girls say they don't trust the vaccine and that their healthcare providers are not fully encouraging the series of injections.
  October 2013 ,Medscape Medical News,Measles Vaccine: Lower Seizure Risk When Given Early On,"Delaying infants' measles vaccination beyond age 16 months, which is sometimes done in the hope of reducing adverse effects risks, nearly doubles their risk for seizures."
  September 2013 ,Medscape Medical News,Pertussis Cases Concentrated Near Vaccine Refusal Clusters ,A surge seen in pertussis cases in California in 2010 could reflect the effect of clusters of nonmedical vaccine refusals.
  September 2013 ,International Approvals,CHMP Backs Nasal Quadrivalent Influenza Vaccine for Kids,"An EMA committee has recommended marketing authorization for Fluenz Tetra, a nasal quadrivalent live attenuated seasonal influenza vaccine, for children aged 24 months to less than 18 years."
  September 2013 ,Medscape Medical News,"Influenza: Vaccinate Kids as Soon as Possible, AAP Says ","An updated AAP statement calls for all children 6 months of age or older to receive influenza vaccination as soon as it is available, using either trivalent or quadrivalent vaccine. "
  August 2013 ,FDA Approvals,"FDA OKs Use of Meningitis Vaccine in Infants, Toddlers",The quadrivalent meningococcal conjugate vaccine Menveo is now indicated for use in children as young as 2 months. 
  July 2013 ,Medscape Medical News,Cervical Cancer Vaccine May Also Guard Against Oral Cancer,"The bivalent human papillomavirus (HPV) vaccine reduced oral HPV infections in Costa Rican women by more than 90%, researchers say."
  July 2013 ,Medscape Medical News,HPV: Less Than a Third of Patients Vaccinated,The reality of HPV vaccination does not match the professional support for the prevention strategy.
  June 2013 ,Medscape Medical News,CDC: HPV Vaccine Is Lowering Infection Rates in Teen Girls,"The prevalence of HPV infections in adolescent girls has declined significantly since the human papillomavirus vaccine was introduced in 2006, a new CDC study estimates."
  June 2013 ,Medscape Medical News,"MMR: ACIP Vaccine Recommendations, Japan Rubella Outbreak ",ACIP's new vaccination recommendations include expansion of MMR vaccines for children and for pregnant women with HIV; report updates information on rubella outbreak in Japan.
  May 2013 ,Medscape Medical News,Vaccines: New Surveillance Tool Detects Public Concerns ,"A new global media surveillance tool detects and monitors public concerns about vaccines in real time, which could help public health officials avoid vaccination refusals and disease outbreaks."
  March 2013 ,Medscape Medical News,"No Evidence Multiple Vaccines Raise Autism Risk, CDC Says","The number of vaccines administered, either in a single day or during the first 2 years of life, is not associated with the risk for autism, a new CDC study shows."
  March 2013 ,Medscape Medical News,Pertussis Incidence Rises as Fifth DTaP Dose Immunity Wanes,An analysis of vaccinated children in Minnesota and Oregon shows an increase in pertussis incidence as immunity from the fifth DTaP dose wanes before the adolescent booster is due.
  March 2013 ,Medscape Medical News,FDA Panel Recommends 2013-2014 Flu Vaccine Strains,The panel agrees with recommendations from the World Health Organization on the best components for next year's influenza vaccine. 
  September 2014 ,WebMD Health News,Paralysis in Children With Enterovirus D68,"Some children hospitalized with breathing problems caused by enterovirus D68 in Colorado and Kansas City have also developed unexplained paralysis in their arms and legs, officials say."
  September 2014 ,Medscape Medical News,Chikungunya Virus Concern Growing ,"Experts express growing concern about the spread of chikungunya virus, alert providers about its presentation, diagnosis, and management."
  September 2014 ,Medscape Medical News,Millions of US Children Losing Out on Preventive Care,Lack of routine childhood screenings and vaccinations may have a long-term effect on health.
  September 2014 ,Medscape Medical News,"Be on Lookout for Enterovirus-D68, CDC Says",The CDC is investigating whether the rare virus is responsible for outbreaks of respiratory illness among children in 11 states. So far the agency has not received reports of neurological complications.
  August 2014 ,Medscape Medical News,Neonatal Vitamin K Refusal Linked to Immunization Refusal ‏,"Refusal of neonatal vitamin K is uncommon and is linked to midwife delivery at home or in a birth center and refusal of immunization, according to a retrospective, population-based cohort study. "
  August 2014 ,Reuters Health Information,Idaho Reports Alarming Rise in Whooping Cough Cases,"Idaho health officials urged vaccination to combat what they said was an alarming rise this year in the number of cases of whooping cough, which has killed an infant and afflicted 240 other state residents since January."
  July 2014 ,Medscape Medical News,$17.1 Million Prize for Solving Antibiotic Resistance,"A bounty of 10 million pounds ($17.1 million) will be awarded for an inexpensive, quick, and accurate point-of-care test for identifying or ruling out bacterial infections."
  July 2014 ,Medscape Medical News,PCV-13 May Not Fully Protect Children With Comorbidity ,"Among children vaccinated with PCV13, invasive pneumococcal disease is more common in those with comorbidities, suggesting routine vaccination may not be enough to reduce this risk."
  July 2014 ,Medscape Medical News,Childhood Vaccines: Serious Adverse Events Rare,"The benefits of routine childhood vaccines outweigh the risks of rare adverse events, researchers say."
  June 2014 ,Medscape Medical News,Third Meningococcal Vaccine Recommended for Children at Risk ,A third meningococcal vaccine is an additional option for children at increased risk for meningococcal disease. 
  June 2014 ,Medscape Medical News,2011 Measles Outbreak Highlights a Familiar Pattern,"An unvaccinated child, exposed to measles in Africa, was the source case for an outbreak among a community subpopulation in Minnesota."
  June 2014 ,Medscape Medical News,Rotavirus Vaccine Greatly Reduced Healthcare Use ,"Diarrhea-associated healthcare use dropped dramatically among vaccinated and unvaccinated children after vaccine introduction, with an estimated savings of nearly $1 billion in 4 years."
  June 2014 ,Medscape Medical News,Uptick in Worldwide Polio Cases in 2013 Continues Into 2014 ,"After decades of progress toward polio eradication, public health authorities saw an 86% increase in cases between 2012 and 2013 worldwide."
  May 2014 ,Medscape Medical News,Measles Vaccine Refusal Helps Make 2014 a Record Year,The number of measles cases through May 23 is the highest year-to-date total since 1994. The CDC attributes the spike to overseas travelers spreading the virus among unvaccinated areas of the country. 
  March 2014 ,Medscape Medical News,Provaccine Messages May Backfire Among Parents,Researchers have found that current public health messages may be reducing the misperception about vaccines and autism but not increasing intent to vaccinate future children.
  January 2014 ,Medscape Medical News,ACIP Releases 2014 Pediatric Vaccine Schedule,"Pediatricians, family physicians, obstetrician/gynecologists, and immunization experts from the CDC have approved the updated 2014 immunization schedule for US children and teenagers."
  January 2014 ,Medscape Medical News,"HPV Vaccine and Others Safe, Effective When Coadministered","The HPV vaccine and other vaccines commonly given to older children, adolescents, and young adults were safe and effective when coadministered."
  January 2014 ,WebMD Health News,Liquid Tamiflu Shortage in US,"The liquid formulation of the antiviral drug oseltamivir is in short supply because of early strong demand, according to its manufacturer."
  December 2013 ,News Alerts,One Lot of HPV Vaccine Gardasil Recalled,A small number of vials of Gardasil in lot number J007354 may contain glass particles in what federal health officials call an 'isolated' manufacturing incident. 
  December 2013 ,Medscape Medical News,Most States Letting Down Guard Against Infectious Disease,"A new study has issued a clarion call to improve the nation's ability to prevent, detect, and control diseases ranging from influenza to HIV."
  March 2015 ,Medscape Medical News,Changing Etiology of Bacteremia in Kids Poses New Challenges,Serious bacterial infection in children in the ED is increasingly healthcare-associated and less susceptible to empirical therapy.
  March 2015 ,Medscape Medical News,Childhood Vaccines: Parents Often Ask Docs to Spread Them Out ,Physicians need strategies to increase the timeliness and completeness of vaccinations. 
  February 2015 ,Medscape Medical News,Intranasal Flu Vaccine Appears Safe for Egg-Allergic Kids,Children with a history of allergic reactions or anaphylaxis after egg exposure safely tolerated the live attenuated vaccine.
  February 2015 ,Medscape Medical News,Azithromycin Linked to Pyloric Stenosis Risk in Young Infants ,"Oral azithromycin or erythromycin use may increase risk for infantile hypertrophic pyloric stenosis, particularly with exposure in the first 2 weeks of life, according to a retrospective cohort study."
  February 2015 ,Medscape Medical News,AAP Updates Measles Recommendations ,"In light of the ongoing measles outbreak, the American Academy of Pediatrics has updated its RedBook chapter."
  February 2015 ,Medscape Medical News,Pneumococcal Vaccine May Not Prevent Invasive Disease in Kids,"In children with comorbid conditions, invasive pneumococcal disease causes higher morbidity and mortality, and many cases are caused by serotypes not included in current conjugate vaccines."
  January 2015 ,Medscape Medical News,Cluster of Acute Flaccid Myelitis Linked to Enterovirus D68,Researchers in Colorado describe cases of pediatric neurologic deficits and neuroimaging abnormalities that may be associated with the emerging enterovirus D68.
  January 2015 ,Medscape Medical News,ACIP Issues 2015 Pediatric Vaccine Schedule,Updated vaccine recommendations for children and adolescents  are now available on the American Academy of Pediatrics and the Centers for Disease Control and Prevention websites.
  January 2015 ,Medscape Medical News,Rotavirus Vaccination Coverage Remains Inconsistent ,Health departments can use immunization information systems to find sources of infection in the community and identify providers who may benefit from education about the rotavirus vaccine. 
  January 2015 ,Reuters Health Information,Pertussis Immunity Lasts Only Few Years After DTaP Immunization,"The average duration of protection against pertussis after diphtheria-tetanus-acellular pertussis (DTaP) immunization is only about three years, according to a review and meta-analysis of a dozen studies."
  January 2015 ,Medscape Medical News,"MMRV Vaccine Safe, With Rare Adverse Effects ",Several of the evaluated adverse outcomes occurred rarely to not at all after vaccination with either MMR + V or the newer MMRV. 
  December 2014 ,Medscape Medical News,Endgame for Polio Eradication ,The American Academy of Pediatrics has issued a clinical report on how eliminating serotype 2 poliovirus from oral vaccine will lead to eradication of the disease. 
  December 2014 ,Medscape Medical News,Vaccination Protects Children Against Allergic Disease,"Routine childhood vaccination does not increase the risk for allergies later in life, and can protect against atopic disease even in children with a parental history of atopy, new research has shown."
  December 2014 ,Reuters Health Information,This Year's Flu Strain Tougher on Kids Than Other Strains,"If past performance is any indication, the flu strain that is circulating this year will be hard on children."
  December 2014 ,Medscape Medical News,"Pertussis Cases Near 10,000 in California This Year","Through November 26, there were 9935 cases of pertussis with onset in 2014 reported in California, highlighting the need for vaccination of pregnant women in their third trimester. "
  November 2014 ,Medscape Medical News,"Older High-Risk Children Should Receive PCV13, AAP Says ","At-risk children aged 6 to 18 years should receive PCV13, even if they have received other pneumococcal vaccines, according to a new recommendation from the American Academy of Pediatrics."
  November 2014 ,Medscape Medical News,Low HPV Vaccine Uptake Rates in All the Wrong States,"HPV vaccine uptake rates are lowest in states with the highest rates of cervical cancer incidence and mortality, and patterns are on track to keep incidence rates high."
  November 2014 ,Medscape Medical News,Pneumococcal Vaccine Reduces Hospitalization Rates,Young children's hospitalizations for sinusitis and pneumonia decreased in the years after pneumococcal vaccine introduction in Sweden.
  October 2014 ,FDA Approvals,First Serogroup B Meningococcal Vaccine Approved by FDA,"The US Food and Drug Administration has approved Trumenba, the first vaccine against invasive meningococcal disease caused by Neisseria meningitides serogroup B, to be licensed in the United States. "
  October 2014 ,Medscape Medical News,CDC Investigating Four Deaths Linked to Enterovirus D68,One death was confirmed yesterday by the Rhode Island Department of Health in a child who died of Staphylococcus aureus sepsis associated with EV-D68.
  September 2015 ,Medscape Medical News,"West Nile Virus Rising in California, CDC Reports",A new report from the CDC summarized 2014 surveillance data for nationally notifiable arboviral diseases in the United States.
  September 2015 ,Medscape Medical News,AAP Backs Mandatory Vaccination for HCPs,"Influenza vaccination should be mandatory for all healthcare personnel, according to the AAP; the AAP also made recommendations for pediatric influenza vaccination for the 2015-2016 season. "
  August 2015 ,Medscape Medical News,Group Offers Guidelines to Lessen Vaccination Pain,"Clinicians can shuffle the order of vaccine injections, leverage the calming influence of parents and breast-feeding, and routinely apply topical anesthetic to ease vaccination pain for patients."
  August 2015 ,Reuters Health Information,Rhode Island Move to Mandate HPV Vaccine in Schools Faces Criticism,"When Rhode Island seventh graders start school next month, the state's Department of Health will require they be vaccinated against the sexually transmitted human papillomavirus, over the protests of parent groups."
